,text
451,lol went church end little bit
452,amazing blown away
453,would scared wear headphones someone wore sweat grime
454,drummersthree
455,sounds like music taken super mario brothers
456,whole lot kempers
457,every come together chanel listen another outstanding song snarky puppy like lingus released
458,million likes
459,need drums aguante marcelo woloski nomaa
460,like telling horror terror story
461,always wonder kind music almost exclusively male thing
462,song masterpiece
463,totally one body brain might getting impulses voice comes unified wow
464,unbridled joy
465,
466,hi normally comment anything watch making exception definitely something spirit captured video odd time start shifts movement dark bright shaun trying best hold right moment let go moment around minutes think watched times absolutely watch really want say think loved music much much younger listening return forever rip chick revived zeal music thank
467,got vibes dave matthews band dreaming tree one epic songs ever intro certain parts
468,bald guy front actually slow seizure
469,anyone know recorded
470,new genre music name existing term unfitting
471,another one khalid voice
472,music listen country drifts slowly towards fascism
473,c est cool avoir pris jason thomas pour jouer avec vous merci pour ce partage que je partage mon tour sur facebook
474,pleasant camera man filming exactly synth guy hits chord omg
475,know hearing good massive volume reduction
476,love wish us tour dates come west please
477,wow
478,shaun martin want end love
479,michael kind tarantino music enjoy nice cool mood wait minutes explodes
480,nada vai superar lingus melhor msica
481,anyone guess many mics many boards needed record insanely clean
482,favorite part video audience reactions
483,finally something match like sylva levels wonderful
484,people think women audience true scroll comments see fewer women audience women naturally appreciate instrumental fusion jazz rock
485,mark lettieri begins arpeggio left side
486,finally
487,complex composition many layers instruments one bass played one michael league
488,john mayer spirit arriving say hi
489,wow really feel heavy times past years total dread tentative hope light end tunnel hope sound naive instant classic love snarky puppy let dance
490,one step higher different yes lord
491,good lord
492,wie immer unglaublich
493,band crowd headphones great musicians know drop
494,needed praise break end bad needed
495,thanks
496,god love line great song
497,unbelievable
498,impresionante
499,mike league amazing feel touch inspiring leader maker extraordinaire
500,first saw room remembered legend movie felt teleportation fifth minute somewhere probably new idk dude epic weird strange dope time
501,anyone explain shaun martin feelin song especially
502,dont trumpet players ever really want break
503,american man ever seen
504,phenomenal
505,band historical think music like anywhere incredible band amazed every time incredible craftsmanship
506,like james bond bad lsd high
507,like james bond bad lsd high
508,merveilleux bravo les gars et merci bonjour de france
509,dope arrangement loving churchy vibe end whew thing got good
510,nasty
511,rip brotha bernard wright influence
512,want bass least hug get carried away think
513,someone get high
514,seriously want know mostly dudes
515,perform gospel choir
516,adoro som de vocs artista abrao
517,wow absolut masterpiece
518,impresionante felicidades
519,
520,used kind music beautiful music groove love
521,good audiophile headphones amp sounds great awesome band
522,watcha snarky puppy
523,berklee kid shit tbh
524,got goosebumps going crazy stimulating eargasms maximum
525,oh stole engine earz experiment however spelled short lived project knew exact chords gonna come drop blah electric guitar part even given electric guitar hiding plagiarism
526,holy fricc triangle goes hard
527,opportunity see guys perform three different occasions always left awe skill talent possess latest effort flawless chain
528,incredible joyfull full love life music great hear piece mark lettieri extremely thankful groove
529,love giving big gil evans vibes
530,well done guys iam happy hear amazing song whose scream
531,thank overwheming
532,throwing challenge idea snarky puppy musicians playing live tracks jacob collier cubase song project
533,cool go go music style dc end least seems strongly inspired influenced style
534,rather listen skinny puppy
535,legends
536,glooooory come somebody good
537,really like bob keep showing us unusual yet nice sounding guitar brands fodera tokai makes thinking f g p logo
538,kool track reminds movie commando
539,wow composition awesome want see video production many lines going board monitor mix lastly room mix one anyone else notice shot michael hitting big note sliding neck mix interesting
540,sound engineer hey michael many drums need next album michael yes
541,wether weport style
542,f b
543,body language audience represents
544,pipe dream version lingus
545,maybe someday one luckiest humanbeing earth sit
546,decided put advertisement middle song
547,read crew necks polo necks thing chriss smock shows far ahead curve guy
548,ya never miss huh another banger playlist
549,missin snarky puppy coziness performances people sit close surrounded incredible greatness set time learned great band could see far stage gotten popular fill huge venues rightfully really want able sit close like began
550,damn im blown away call party love vibewhich try describe thousand wordsbut often feels like playful subtle homage prince
551,outstanding
552,sax solo gripping thought going lift chair
553,song year right
554,good job bro jesus coming back soon prepare
555,awesome fing awesome
556,si existe esto debe sonar el cielo
557,beautiful
558,level sound quality musicianship always unreal
559,shit sounds like hot sauce chicken bacon cajun fries
560,snarky puppy best
561,love
562,isso uma banda uma puta orquestra os caras nata dos melhores uma odissia
563,got enough guitar players
564,gonna break neck
565,audience like zombies one ha one love band
566,must coming somewhere outside space unreal yet bloody funky subtle well amazing work bunch technicians included course probably spent several days setting whole place absolute perfect result question double sound take horn wind ribbon type microphones seems wanted make sure keep enjoying
567,interested guys ever heard memory elizabeth reed allman brothers much sound comes straight fusion piece
568,wow grandiose everything done live tracks love great sound video well
569,open mahavishnuee
570,amazing
571,
572,thanks posting
573,
574,enough woman least half woman
575,gospel according snarky puppy
576,bill moog solo love bill gets spotlight small tasty moment
577,wow joy one must feel room listening music geniuses
578,amazing amazing michael league bill laurance play new fusion jazz
579,break band could include percussionists sitting clapping thought audience ha
580,opposite metaverse puts eyes mask look stay sugerberg profit
581,holiest lines holes eeridesense drums trigger soul food soul food
582,deep like minds minolta
583,aie aie aie excellent excellentissime thank
584,mins get meat goes seconds back corny building riff nowhere good song lingus
585,missing energy made snarky puppy good musicians feel kind burned uninspired tenor solo pretty lame
586,watching snarky puppy play always experience
587,love video anybody know footages included album release case earlier albums
588,comeo tambem
589,final da musica eh uma coisa anormal
590,nao nao tem como muito bom
591,would damn near heart attack yall went praise break
592,kept taking turns expect lol
593,lingus
594,
595,much cost ticket see guys
596,go home
597,
598,please get extended extended version
599,yeah felt words describe music
600,hell kinda cymbal zildjian dude take back warped heat
601,producer michael snarky fam would like include next venture michael league yes
602,really hope aliens watching us catch moments
603,guitarists know try layer multiple takes recording take take take trying get timing tight live first try sound like one guitar notes start end perfectly sync damn
604,sounds like soundtrack movie genre doesnt exist yet amazing
605,accidentally played x speed much better ppl clap fast haha
606,butter
607,guys really best deserves mlns k views waiting new album
608,stepped music another level radiohead would say one songs everything right place
609,bucket list see snarky puppy perform live
610,love
611,someone notice legendary jubu smith
612,
613,great googly moogly good
614,way outta da park
615,whoa
616,larnell needs signature tripp pants deep pocket
617,seth rogan guitar jokes aside marvellous
618,watching video sean martin transported somewhere dimension musical bliss fucking incredible expect nothing less guys amazing thank
619,awesome already enjoyed times today setting new speaker system church perfect mean pretty perfect bigger always better bigger speakers better
620,ngl lost bit immigrance one amazing wait hear
621,walls would saying thanks guys love
622,karunia allah yang jatuh ke bumi
623,probably listen high quality setup might cry much
624,boy larnell lewis unreal performance
625,change band member especially keyboard player
626,bringing back like family dinner sound tears eyes waited nearly decade finally
627,much diversity
628,boom
629,abstolutaly terrific
630,snarky deja de sorprenderme wooowwww
631,
632,im trained musician appreciate great music mind blowing see multiple drummers keyboards play one accord nothing short amazing hopefully ill get catch guys live one day
633,loving change ups one
634,seconds already existential crisis
635,call dibs theme song ever become worlds powerful anime detective assassin billionare mecha pilot space pirate boxer
636,felt holy spirit end
637,got love guys front row competing show appreciates groove
638,got free headphones
639,hot damn
640,man wow
641,ok really good wtf audience wearing headphones
642,groove insane sound engineer made equal job sounds amazing
643,know bring funk
644,good music event sucks people chained seats
645,next level
646,project precious steady delight us
647,sooo good
648,point gig headphones sad statement modern world everyone heads think concept sucks
649,horns
650,actually didnt intend say anything sound says much
651,mind blown thank
652,uzeb
653,anyone else gets frank zappa vibe
654,like broke shaun makes cry everytime watch awesome
655,h e l c c
656,would awesome guys song guthrie govan
657,anyone else counting
658,yall better give praise lol
659,amazing collaboration musicians see put minds talent together
660,usually mixdown hard taking tracks stereo surround image sounds good across sound systems car plus adding sonic niceties reverb usually hard creating sonic palette various performances basics dubs time someone writes great song gets arranged beautifully enough musicians play parts live recordists amazing job capturing instrument plus sound room put faithfully media mixdown becomes embarrassingly easy simply bring faders balance maybe tweak something maybe sit back smile suspect mixing probably like
661,could really really without goofy head boppers front kinda like watching streisand sing tolerate obnoxious distraction incredible music
662,swing chega e derruba voce da cadeira
663,awesome see new sessions u guys uge fan love
664,somehow felt shawn lane vibe around anyone else
665,
666,snarky puppy praise break thats world heal lol
667,ce n est pas la meilleur
668,extended version needs actual album
669,killer band introduction fusion jazz easily best musicians planet larnell man saw replying ato comments know monster though probably need say jt jamison killing always wonder man sput hoping catch live since forever ago probably gonna come live show germany october th hope see
670,gokssss verryy veryyy goodd mannn
671,organ end though start something
672,something band incorporates drummers percussionists guitarists including bass guitar keyboard players alpha omega
673,absolutely love always manage find spot song shaun martin gets opportunity shine well play notes dance ass
674,disable ads good song total bummer three commercials play every time want watch
675,bass clarinet goes fucking hard bruh
676,super super artist
677,
678,actually insane words
679,words really justice pure beauty sean believe name scream let end jamming improvising special like awesome witness got fucking teary eyed intense relatable anything pure conduits antenna vessels whatever want call sean well guys group blessed us enjoy watching everyone elation pure joy special humble opinion actual performance everyone room felt vibration energy simply overwhelming great way times sean let raw way end kind encapsulated everyone rooms high vibration energy continued blessings
680,based single amount musicians feel like album produced
681,never gets old stuff keeps getting better age glad stumbled across guys years ago broadened musical library thank
682,mossooo os cara cria coisa top
683,outro definitely earth wind fire feel sure
684,larnell sput nate sign
685,look drums woohoo
686,oh man long welcome back peeps f happy
687,daaaaaaaammmmmmmnnnnn
688,dare commercial interrupt first listen realize genius never interrupted
689,feel guy long hair crowd feels
690,yep expressive e osmose atop rhodes holding breath delivery mine oh also bad bunch youngsters
691,literally everything changes beautiful
692,saw guys live came austin texas phenomenal concert would love see guys perform extended version trinity transcends us next level iykyk keep making music snarky puppy
693,set iconic
694,quartermaster end haha
695,missing cello player
696,fantastic
697,thank really snarky puppy rules
698,vrios pombos de fone kkkkkk
699,pull nice nice headphones one
700,bliss
701,gender distribution audience tell us instrumental music band suppose know alert cultural war sexism intended empirical assessments
702,death penalty fucker placed advert song finished
703,one thing like larnell setting praise break end nobody picking
704,como sempre espetacular j estou acostumando mal todo lanamento snarky eu j sei que vou apaixonar
705,
706,groove nice everything great frustrating try listen two ads one minute music beyond absurd makes music unlistenable
707,excellent
708,females allowed band audience
709,best wow
710,ty
711,oh damn nard end
712,question musicians risk mistakes increases number musicians increases form big band sheet music performance recording producer low level risk aversion mistakes corrected edition recording musicians extraordinary memory anyway snarky puppy great innovator instrumental music century great jazz pop rock big band release wait anxiously next great live studio recording
713,engineered nic hard matt recchia michael harrison engineering assisted skyler childress michael league shakthi prasad kt mixed nic hard mastered dave mcnair guys deserve claps well mixing insanely good
714,nard beautiful exists
715,love guys
716,everone bobbing head look like ducks
717,created musical composition heavenly good got question music exists tho
718,kind band wish could start
719,ufff
720,yuuuuuuuuuuuuuuuuup
721,thankful get earth time guys theyre nothing short phenomenal aside cant help feel theres something else shaun martins reaction end privy
722,beginning feeling like movie intro
723,
724,dcolle pas cest agaant jpp
725,super cool instant favourite
726,
727,still giving goosebumps listened like times repeat good
728,marvelous enjoy glasto guys xx
729,everybody say blessed blessed blessed
730,concert guys women video talented tight cup tea heart
731,musical ensemble perfection back awesome usual grooving impossible sit still
732,somebody felt real deep bass ooooo
733,keyboarder kemper
734,camaraderie spirit sound performance got smiling ear ear like cheshire cat one beautiful experience
735,boom
736,damn wish gospel shout end
737,thank beautiful concert movie perfectly staged enlighted filmed finished benchmark
738,triangle groove
739,ads know fuck greatness
740,dwight schrute killing sax
741,gospel would say main message bible work jesus christ son god cross humanity talking jesus cross need look problem humanity problem every one us faced despite efforts person cannot earn way heaven romans says sinned fall short glory god anyone examine know even though yes sometimes good also evil times commit moral crimes rebel god bible calls sin lie steal blaspheme god lust hate brother hearts sins likely every person earth committed god loving holy merciful among attributes also perfectly like crime sin punished god punish sin would unjust would corrupt someone take punishment romans says wages sin death free gift god eternal life christ jesus lord talking spiritual death physical death die sins go hell good evidence humans souls near death experiences one evidences part lives past physical body god sent son earth years ago son jesus christ jesus christ promised savior world fulfilled hundreds prophecies coming world jesus born virgin lived sinless life crucified cross payment sins god poured wrath jesus place meaning justice god satisfied sin punished still enmity god god still wants save us romans says god demonstrates love toward us yet sinners christ died us three days jesus crucified rose proving payment enough said son god real world evidence life death resurrection jesus christ nice story scripture tells us repent put trust jesus follow lord repentance means change mind means turn life following sin life following christ salvation free gift cannot earned one perfectly moral impossible way presence god heaven important reiterate cannot save gift god one saved god rich mercy ready forgive cry sincere coming god flippant thing repent place trust jesus christ alone today day salvation ephesians says grace saved faith gift god result works one may boast salvation gift way jesus said way truth life one comes father jesus way truth life romans says confess mouth jesus lord believe heart god raised dead saved
742,nasty
743,bass clarinet
744,get another one legendary flood tho
745,super cool kinda hard enjoy theres midway ads
746,snarky ppupi increbles fantastico sonido coordinacion sobre todo muy buena msica
747,yall still got love sections sucks ad minutes would nicer pre post roll
748,one song set
749,insane
750,world flat keyboard top rhodes looks cool heck edit found called osmose made expressivee
751,awesome tx
752,possible assemble large group musicians without single woman
753,awesome
754,absurdo
755,anywhere get sheet music gotta play licks
756,absurdo
757,usual amazing
758,audience exactly expected
759,noticed many cymbals bent holes hope got discount slightly irregular percussion another great tune awesome band
760,internet
761,rhythmic harmonious time complex sounding simple
762,os caras fora da curva
763,animusic type beat
764,good see guys together tell appealed music geek equipment geek
765,hell yeah love
766,first man public realy feeling groove
767,well know dance moves never done
768,way record band capture really
769,lawd ha mercy talented gentlemen
770,simply incredible
771,oh another sp album get seriously obsessed
772,would make superb bond theme
773,
774,amazing impressed band recording video composition production etc yet still left emotionally left cold
775,done melody vamp shout groove scary
776,another spectacular performance huge fan stoked see sp cincinnati tomorrow night steely dan sadly seeing live great able experience music way people would amazing midst many amazing musicians sp best
777,excelente toda una escuela felicidades lopez
778,waaaooooowww
779,masterpiece although cory henry would beyond imagination
780,thank goodness
781,bass clarinet badass color
782,bananas point absolutely love everything guys put clue guys shot never even see cameraperson amazing
783,sonzeira
784,comments missing every video right
785,friends sitting around basking dreamland
786,best thing ever heard holy crap snarky puppy going places
787,intresting isnt michael great nonetheless
788,favorite musician favorite musicians
789,fenomenales como siempre
790,final shot nard made heart smile harold went saw face got full real quick hold man love much u know whole band killing done even see mike league first minutes mark u composed banger boi sho nuff hope die big ole greasy banger headphones justice headed car drive next minutes give baby runs real speakers
791,michael upped got lads back together wonderful
792,almost feel like one released halloween hell tune
793,fantastic band groove musicality love thank artists
794,wonder sounded room without headphones
795,wait blow bring back
796,got nice herbie hancock mwandishi era sound groove props eddie henderson bennie maupin
797,much quantization autotune half band even playing anything sitting headphones
798,play drummers step anyone feet
799,like listening first time amazing
800,like well orchestrated spy movie soundtrack
801,oh go another masterpiece everyone right place terms arrangement mix sounds outstanding thanks guys
802,memory see anyone reading amazing writing arranging playing mixing recording
803,killer hahahah
804,incredible good
805,hanging cloth humming sanitymusic healing powerthe power three
806,amazing sadly portugal included european tour feel sort pink floyd shine
807,rip dallas legend bernard wright gentleman dancing end video wow
808,marvelous
809,amount gear production must taken blows mind holy shit
810,mastering
811,clearing vibes
812,banger
813,victory lap
814,know band knows shit half members wearing glasses
815,thing would make better would trombone two
816,snarky puppy keeps getting better better love jam
817,sensacional sou muito f
818,ads middle song illegal
819,really updated synth collection sheesh
820,excellent production much talent one session paper people tech musicians mr martin almost made get holy ghost let say vibes music
821,top pops next level boogie wookiee crawdaddy jamtastic
822,djazz
823,yes
824,jaga jazzist esque e day
825,discovered snarky puppy early never headbanged hard life shofukan sleeper jambone lingus binky trinity part religion
826,feat arrangement production stonking good track helps thank people involved includes generous funders
827,era big band back without inflated egos gotta love harmony humility much love guys
828,bravo
829,create vibe create atmosphere
830,amacing
831,ta buenisimo como lionel mesi
832,
833,fuck yes done scared go live show shock forever
834,dancing office desktop right
835,heard live okc last week pure fire
836,fascinating music brilliantly played recorded sessions special occasions people witnessing extremely lucky concept smart approach brings best performers opens door magic
837,shaun taken church end
838,larnell playing whole song would made top snarky drummers awesome btw
839,beautiful songs arrangements im always looking guys listen capture songs arrangements awesome musicians arrangements thanks music musicianship
840,man letieri keep loving music also nod van halen keyboard letieri thing
841,groove movin tears wth
842,im happy snarky puppy back
843,last show witnessed snarky puppy live royal albert hall london ready album tour
844,sums reaction pretty accurately
845,hey michael many percussionist need yes
846,aaaamazing
847,wow mix something else would love learn engineer mixed mastered session mixing large number instruments easy could feel hear instrument crystal clear great job done band time favorite band
848,also dvd release
849,see huge bands like figure person takes home like gig
850,kudos audio engineers amazing mix
851,neo king crimson
852,song amazing talk huge mix sounds breathtakingly gooood
853,interesting shuffle groove nice
854,miss guys
855,love moment triumph shaun martin gets end pure emotion fitting reaction job done well hat always crew wait album drop
856,love vigor
857,piece spectacular love layering transitions
858,feel like snarky puppys prep recordings must go beyond rehearsing music group size express apparently consistent joy positivity id think intentional group meditation retreats profit sharing twister maybe power music nahhhh couldnt
859,likes m_b cory
860,world peace must feel like absolutely stellar
861,oh gosh groove deep
862,awesome
863,distorted guitar stereotypical video game sound could straight mario sonic game
864,larnell almost started whole praise break woulda made x better
865,shaun martin reaction organ priceless everybody needs friend like
866,layers upon layers upon layers upon layers song moving machine sooooo maaannnyy gears vamp sus chord end surreal lush
867,mf rick grimes killing percussion
868,bass clarinet riff
869,ehh
870,came destiny stream disappointed
871,third listen wheeewww
872,worst woke band ever
873,yet another work art
874,brilliant glad guys honored bernard wright like cant wait see hear performances album used go see pussycat lounge monday nights years ago wes funky knuckles unt crowd whoever town always something supernatural somewhere prince mccoy tyner
875,waiting long
876,man insane
877,starts vibe goes higher clouds stars sky
878,could watch shaun diggin whats going remember band ntsu back called nucular hamsters think going direction maybe influence maybe theres something funky denton wateryeah thats probably
879,wait full album release september love forever snarky puppy greeting brazil
880,awesome like mayonnaise chocolate chip cookies music
881,yaaaaaaaaaaaaashhhh
882,good shaun martin church end
883,shaun martin everyones facial expressions yet
884,last time saw heads nodding groove like steely dan concert
885,type music wanna get sacrificed jungle
886,church
887,fell love music much thanks band great musicians video
888,content good watch free
889,lingus ish feelings rn
890,speechless wow
891,voltaram com tudo
892,promise least one high school band kind band props intricate choreography flag carriers costumes use tune show fall
