,text
893,maaaan listening headphones trip panning guitars come around funky sounds absolutely gorgeous
894,still chasing high lingus years ago
895,ear morphine push fucking button enough
896,yeah slap ad right middle shit mmmmm immersive servile song
897,great stuff
898,kind music makes play love music
899,thanks youtube algorithm suggesting gem artist
900,top level musicians fun
901,month ago know snarky puppy days ago brand new like cd dvd arrived yesterday watched entire dvd twice find new sp stuff last freaking friday man feel lucky
902,amazing
903,lingus das good shit
904,ad kemper
905,indisputably superb work modern music hat mr letteiri stunning comnpositon hat bassist mike league providing steady fluid bottom marvelously complex composition hope restored modern music thanks kick ass ensemble musical expertise served genuine groove looking forward new album
906,way michael league plays bass effortless act kind ever seen absolutely beautiful bloody magicians
907,gotta love pupps
908,emoji flamme emoji flamme emoji flamme
909,cannot bring enough drums
910,stop guys damn
911,og gang back except cory
912,words fail snarky puppy wow
913,anybody insight title
914,wow caught violin
915,words drum mers
916,good back
917,yall really went church end freaking amazing always amazing musicians three drummersall faves
918,september aaaaaahhhhhhhhhhhh
919,love michael league things cant understand recording instance sound like soundtrack action film music say america today whats happening country seems like nostalgia instead saying something music connect people great playing though
920,guitar sound delicious
921,sound engineering groovy collective momentum members specially public simply wonderful moment drink sip satisfied thank
922,charts mazing always w crew
923,beyond cool keeps getting better
924,usual mind melted would melt
925,musical orgasm period
926,song great know wanted larnell camera time
927,amazing greetings hugs
928,tool empest intro
929,oni radza sobie jakos czyz nie
930,appreciate three drummers manage sound like one person playing
931,stank face whole song amazing usual snarky puppy
932,trumpeter
933,bring german guitarist martin miller featured guest
934,women place
935,inspiring otherworldly experience sitting room world class musicians im grateful group absolute emotion create
936,dudes front trying anticipate beat
937,back
938,band lame fuck well
939,fans fucking lame always
940,seated audience sense
941,disappoint
942,even begin imagine much money spent setting
943,jeff porcaro approve groove
944,really admire snarky puppys ability maximalist yet still tasteful every instrument still playing essential role final tune
945,got lost counting guitar players drummers lol awesome tune
946,thank guys
947,end thought church lol
948,astounding wonderful always love snarky puppy wish could
949,hallelujah
950,moment right amazing musical moment like ends remotely musical sound electrify room even silence heavy
951,wow seriously hook awesome wait watch
952,dudes matured like fine fine wine
953,thrown party ears thank
954,oh yeas
955,section gives whole new meaning song soo groovy thank snarky puppy
956,yes
957,good
958,poor audience stuck sitting im chair garage dancing killer tune
959,saw live week ago body experience
960,modern day symphonies aural journeys
961,understand horn section made several different people sure sounds like playing using brain
962,man mean wow
963,avengersassemble
964,good thing time get end dont even remember beginning cool arpeggiated guitar chord progression ending part sick
965,goddamn
966,anyone else think sp generations zappa mothers minus gonzo lyrics complex orchestrated pieces involving dozen give take musicians musicians led guy composes guitar odd time signatures almost painful play complexity handled aplomb
967,jammingist
968,love see live session awesome band love guys
969,one thing really like snarky puppy shaun energy man dude pure music energy
970,dude mark really fucking awesome producer
971,soooooooooooooooooooooo looking forward album gig london october
972,big louis cole vibes part starts great tune
973,aside awesome musicianship engineering feat amazing headphones mics looked like woodwinds mics mention percussion ever engineered deserves energetic appreciations musicians get
974,
975,larnell lewis inspiration everything truly didnt comprehend drums ive playing years heard like larnell percussion gods snarky
976,brilliant
977,moment savour fast eat spread die welcome back snarky much missed
978,cory henry still play guys
979,fucking back baby
980,snarky puppy absolute monster band theyre top game recording glad next live cd dvd release even killer fact two drummers appears jason jt thomas time favorite snarky drummer larnell lewis fantastic
981,definitly tool love melting genres always perfect
982,man groove illegal damn good
983,world might suck times group people never fail make reconsider
984,kirk franklin vibes end love song started worshipping along
985,
986,shoulda went lol
987,piece music mad crazy good wish session props mark lettieri mad piece work one little keys sounds like nod brother eddie nice broaden fanship mainstream interest regardless thanks best come
988,yes phenomenal musician well snarky puppy would never great without shaun martin antics
989,longer hair looks dope chris
990,god damn
991,sickest thing ive heard
992,several album long hiatus video style live albums feels damn good see human element seeing play interact together absolutely something else guys continually top game favorite band years seen live disservice
993,gorgeous vibes
994,mad halloween vibes love
995,never seen many kemper stage
996,magic starts
997,gonna release whole footage
998,sounds like great movie soundtrack someone write screenplay around
999,way could get version without visual effects
1000,thank snarky puupy world thanks
1001,say snarkamazing
1002,magical many levels
1003,oh feeling like band zach last missing cory
1004,sound amazing
1005,god love found guys years ago actual jazz band since spyro gyra knows science music sound transformative sound thank
1006,anybody explain exactly pencil mic
1007,love new tune groovy theses smiles playing time signatures changes
1008,groove end
1009,marvelous arrangement great musicianship
1010,amazing always would really love see snarky puppy play bpm techno break beat
1011,guy second row us masterpiece bless ears
1012,jesus might well named tune hold beers
1013,pure vibes room
1014,thank love
1015,love
1016,plz put extended version spotify cant get enough ending
1017,incredible jam amazing getting close years keep composing fresh material tune loop house rest day
1018,aaaaaaaaaaaaa perfeitoooo
1019,somehow think earth wind fire september final part
1020,
1021,thanks retiring love
1022,gotta around million bucks worth equipment room gearheads wanna watch full screen times
1023,phenomenal feel like everyone opportunity confront go much deeper craft two years isolation brilliant much deeper different level game
1024,drop
1025,many musicians need
1026,little flavour bobs soprano adds brass parts perfect
1027,masterpiece
1028,michael slapping new one nice
1029,wild hot groove stop masterpiece
1030,
1031,one word needed class
1032,crying crying
1033,believe finally going see live bulgaria less month wait
1034,mario kart
1035,many kempers single building
1036,wish one listeners sitting love pakistan p shots video crazy percussionists guys com onnn
1037,incredible wait album
1038,gave goosebumps
1039,amazingg
1040,freaking sick
1041,intense tone p bass perfection
1042,whole album coming
1043,snarky puppy thank existing
1044,got hear live days ago amazing concert
1045,goodness yes
1046,great track performance one gripe advert middle know groundup band need paid surely better way found monetise without spoiling look forward full album coming adverts
1047,grammys enough
1048,got funkier
1049,reaction drum fill face making right
1050,big musical chemistry
1051,feels dang good gang back together
1052,que volada de peluca lpm
1053,electric guitars kinda reminds super funky mariokart song times
1054,wait september thank much compositions musicianship taste groove
1055,completely blown away fantastic ensemble musicians
1056,okay let hear bass clarinet bringing groove next going need bassoon
1057,want sending love way indonesia
1058,production beyond belief mix perfect camera work exceptional playing flawless blessed able performances like captured high quality bravo snarky puppy
1059,feel mark lettieri touch song great special attention synth sound
1060,completely new sound new mood ive heard thank mark thanks snarky puppy
1061,fear one day snarky gonna groove hard got damn close one
1062,saw kansas city last night first songs new album including one must see concert disappoint
1063,damn blastthe reprisewords fail soars well done markand
1064,beautiful
1065,bout go church
1066,nard
1067,years ago told dad rock n rollhe big band guy told nothing r r compared count basie believe snarky puppy music would change dads mind would hear see evolution created whole new musical world
1068,back bang
1069,perfect
1070,never met anyone sp music always makes feel like best friends lovers music us
1071,loss words writing comment give gem traction
1072,vibe room definitely advertised love yall
1073,really playing music thats divinity
1074,astounding piece art musicianship writing videography colour grading masterpiece truly incredible
1075,god
1076,absolute insanity perfection huge fan snarky puppy surpassed expectations music upcoming album unbelievable level talent camaraderie band mark lettieri hit home run tune rhythm section tight hell gotta love shaun martin getting spiritual end
1077,nice smooth jazz
1078,simply never fail stunning
1079,great cool
1080,dying
1081,anyone comments jaga jazzist fan
1082,
1083,sax solo sure reminds legendary solo pink floyd time low notes jumps reminiscent mean compliment love solo could also underlaying harmony
1084,man money would given room
1085,wow thought half amazing post credits sequence
1086,je vous ai attendu ans depuis curtain ever magic usual merci bravo
1087,hey bill laurence osmose another great fun track
1088,amen
1089,bombbbbbbbbbbbbb
1090,first seconds snarky puppy lovin
1091,incredible group humans love
1092,best snarky puppy song released
1093,snarky reminding us even peaked yet
1094,oh must mostly tour europe
1095,man crowd lot white men beards bobbing heads white man beard bobbing head
1096,praise break never happened
1097,good stuff many redundant instruments
1098,sick hell
1099,snarky puppy praise break taken church ready
1100,amazing everyone killed
1101,mike trumpet sounds absolutely unreal
1102,yes
1103,
1104,fucking fantastic song love synth stab chords amazing keyboard solo end w h omegalul tf
1105,stanked face minutes straight
1106,virtuoso maestro overlords privileged around incredible listen always
1107,shaun martin dancing clapping along vibe
1108,soooooo happy yet sooooooo sad see nard end smile dance fantastic
1109,history going thanks bass clar
1110,man great sound
1111,great hear bass clarinet fits mood perfectly
1112,gives major brecker brothers vibes
1113,first groove almost like musical trust fall something little scary dangerous still follow along get groove like getting beach walking jungle
1114,incroyable
1115,crazy
1116,groove
1117,whoo hoo
1118,come nobody told new snarky puppy album aaaaaaarrrrrhhhhhhhh
1119,one best live music experiences life song arguably highlight magical evening mark song composed beautifully thank guys gem anxiously wait whole album going get bikes weekend jam trinity riding paths along trinity
1120,first jefe trinity bravo mark
1121,
1122,one get attend concerts
1123,oh fuck
1124,perfect
1125,lucky enough sit two sessions watch incredibleness first hand excited see hear rest tracks massive album
1126,looking forward see u switzerland
1127,cant say enough excellence every level involved
1128,hey groundup music nyc see among pre order options empire central cd set available blu ray cd option maybe dvd cd able listen also watch beloved guys performing masterpieces
1129,meghan markle
1130,love wait see guys open steely dan atlanta next week
1131,chi yo
1132,great audio mix engineer
1133,sort sick sob places ad middle snarky puppy performance
1134,words describe thank making value gift hearing directly brazil
1135,damn getting older halt march time dammit want music end
1136,norme un pure bonheur vraiment des musiciens denfers
1137,handle groove sheeshhhhh
1138,nard
1139,aaaaaaaaaaaaaaaaaaaaaaaaaaaaaaaa
1140,favorite party snarky song shaun gives playing cause good
1141,oohhhhhhh
1142,adds getting hand yt straight ruin vibe insurance add right middle banger like
1143,sheeeeeesh
1144,best jazz fusion
1145,excited new album years
1146,love looking forward whole album seeing london october
1147,groooovveessss soo good
1148,wait three drummers real count right
1149,simply best band planet right
1150,artist signature prs guitar
1151,wow wow
1152,rest peace bernard wright
1153,snarky puppy made day
1154,please come back brazil
1155,absolutely huge
1156,makes happy many levels first snarky puppy much better great video production seeing fun real plus music sencond looking forward hearing new stuff ever since last album came third larnell board big win band favorite drummer also going see th october year already saw easily favorite concert ever lots catch live ever get chance sending love
1157,ooohhhh yessss made day
1158,one got nhl vibes
1159,awesome tune mark lettieri something like much mix master process much compression overall dark sound muddy drums missed hits groove cool
1160,love live recorded albums stoked see coming
1161,e l vem eles de novo fantstico
1162,one could argue drummers percussionists keyboardists guitarists much see playing virtuos player fun friends playing music everyone bringing makes unique one chord one sound effect play filled technique musical thought also tons joy time stop playing clap along cool
1163,damn groove good made yesterday leftover store bought gnocchi taste like finest dish prepared old nonna francesca beautiful italian village absolute chef kiss
1164,much love tokyo love guys snarky puppy
1165,jameson came back room okay groove literally never ending best ever spent
1166,que banda que som
1167,explain hyped album
1168,guys fanfabulous composition great play funky mother production amazing every little detail stands grittyness livetrack completely contained wow video production also got big notch lighting grading sooo tasty good job everyone cant wait rest drop con grats best per
1169,os melhores
1170,seeing nard joyous self end made tear special us dallas im glad able meet first time one recording sessions
1171,much funk much funk one music artist composer another fire
1172,love watching everyone crowd subdivides beat differently hah
1173,welcome back
1174,want life one people sitting studio
1175,outstanding always guys thank posting
1176,back live recording sessions yeah great tune great arrangements great groove congrats mark lettieri almost forgot one thing great mix
1177,oh god even possible give life deep powerful groovy music insane pure joy heart pure shaking booty supposed without ukrainian invasion thank music
1178,soooo good
1179,chords vibe
1180,love good half minute swamp monster intro funkiest shit ever heard
1181,everyone jamming guitar center plays song
1182,simplesmente uma obra de arte
1183,loved seeing great late nard end thank
1184,vamooooooo snarkyyyyy
1185,mind bending yet thoroughly enjoyable composition definitely need get album
1186,holy fuck felt song soul
1187,probably alone think electric guitar tone texture work interesting composition kudos mark guitar sounds generic lead tone pulls vibe almost instantly
1188,oh man low end kicks amazing feeling
1189,piece art love gonna discovering new things many many listens
1190,bruh brought drummers one
1191,lingus vibes without crazy solo
1192,holy shit man blessed soul waiting patiently album guys edit one compare tune good man deliver best blessed album tell friends since think exact form could wrong dunno see far pups come since back
1193,chris bass clarinet gave chills another level depth bravo snarky puppy
1194,data projects half jazz drummers us snarky puppy
1195,feel like slinked around haunted forest dove swamp viscous water thorny roots grappled ancient beast returned triumphant funky elf like people awesome song
1196,ofc mark wrote one lmaooo banger
1197,ohhhh back back back
1198,
1199,simply masterpiece party celebration life form music snarky puppy brazil loves
1200,expecting pure joyousness
1201,glad bringing us live recordings dynamic group incredible
1202,one wasted note rest stunning heart pounding chest listening
1203,time signature
1204,
1205,watching im getting shivers spine thats snarky puppy groovy juicy tasty nasty
1206,clearly new show ender along shofukan chonks love much
1207,wow
1208,seeing snarky puppy tonight steely dan tickets concert tulsa years ago ended call missed threatened wife going fly dublin hear live next tour date hate steve winwood dropped tour steely dan snarky puppy
1209,insane
1210,want see picture mixing table used impressive stuff congrats mixing recording staff
1211,rererere watched lingus yesterday today new snarky material lucky people witnessing
1212,never knew bruce banner hulk played guitar
1213,wish cory henry
1214,thank god im alive see
1215,song fucking everything like everything wanted fuck
1216,simply incredible
1217,groove thick generated black hole even make sense swear happened
1218,einfach wunderschn
1219,bark bark woof woof
1220,every man audience look like clone
1221,slapped sick solos healthy groove set way rock snarky puppy thanks another banger come back
1222,banger
1223,wow loved recently discovered snarky puppy fell love like glad see new upload hope plenty coming
1224,omg please tell bill gonna use osmose one tracks
1225,nice glasper cameo
1226,awesome time one though
1227,went straight church end
1228,nice see mark stepping cory wong
1229,blissful
1230,fliping estoy flipando
1231,trip insane
1232,gentlemen nasty waiting drop smh yall smashed wait rest album letsgetit
1233,dude mix insane guitar talkbox doubling subtle perfect everyone comes right need props engineers classic snarky puppy song already
1234,groove nastyyyyy
1235,strong feeling miles
1236,absolutely phenomenal puts smile face
1237,yes please
1238,back live recordings feels good
1239,anywhere anyplace world anybody find gold life move give everyone meet love im indescribably joyful found many many many thanks pure awesomeness snarky puppy
1240,make space couple
1241,felt shaun
1242,excellent
1243,sounds great dudes pleasure hearing new stuff woodlands last week looking forward new album
1244,awww yeah theyve back
1245,snarky puppy art bringing musicians room everyone knows place mix amazing production recording
1246,lets goooooooo
1247,thanks god exists
1248,bernard
1249,people need hear absolutely mindblowing organization creativity goes projects
1250,freakin good
1251,good
1252,pure musical exploration best love snarky puppy always forever
1253,michael league time upgrade better bass man cant hear mix
1254,shaun martin
1255,track groove double vinyl hip cats swell
1256,first time heard mike play slap bass also horn lines insane beautiful song mark
1257,jesus christ mark
1258,track might best dolby atmos spatial audio mix ever heard apple music sure check super hyped album
1259,like part also doubt add everyone band absolutely phenomenal
1260,increblemente mgico como siempre
1261,whole intro section absolute atmosphere
1262,love fuggin band much
1263,man great thing see pop cap birthday insanely groovy vibes always looking forward september
1264,groove one deeper wherever pennies get lost inside couch heck yeah
1265,yooooooo early one gotta love jazz fusion
1266,ce ta doido vei brabissimos
1267,mark gets one solo
1268,listening guys lot lately hyped new music
1269,best music
1270,long since weve graced one videos
1271,simply phenomenal
1272,follow orquestrapopular
1273,world made right even minutes ill take
1274,music always help gain focus calm especially studying thank
1275,c mon bill
1276,amazing good
1277,able sit insane waiting months hear hard thankful moment right
1278,wow huge group jazz funk superstars guys always make day
1279,making snarky live video definitely bucket list item checked
1280,awwww yea mark song single night show fuck yeeaaaaaaa
1281,rip dave smith
1282,holy shit
1283,roots
1284,awesome
1285,aspire live life like man
1286,vibe
1287,thank god new snarky puppy breathe
1288,slaps
1289,win listen instead binky mornings groovy way start weekends love guys hi shaun way
1290,excited proud patron labellove guys much
1291,love bottom guy reaction reacted way
1292,seeing guys cincinnati week wait former drummer still trying wrap head around two drum sets work together
1293,thank wonderful track foresee many many views future one best musical groups planet
1294,ear responsable ear radiant irresistable irrecusable
1295,feels good yikes
1296,super excited first video drop empire central amazing courageous mark lettieri composition tune starts bass clarinet set texture winner book wait drops empire central
1297,back roots live album recording today feel lucky alive
1298,nice
1299,expecting go hans zimmer happy
1300,watching yall show kc yall killing lol
1301,yess sirrr
