id,author,date,content,class,video_id,channel_id,date_published,video_title,like_count,comment_count,view_count
0,Lisa Wellas,,+447935454150 lovely girl talk to me xxx﻿,t,uelHwf8o7_U,UC20vb-R_px4CguHzzBPhoyQ,2010-08-05,Eminem - Love The Way You Lie ft. Rihanna,12441625,597028,2488042269
1,jason graham,2015-05-29,I always end up coming back to this song<br />﻿,f,uelHwf8o7_U,UC20vb-R_px4CguHzzBPhoyQ,2010-08-05,Eminem - Love The Way You Lie ft. Rihanna,12441625,597028,2488042269
2,Ajkal Khan,,"my sister just received over 6,500 new <a rel=nofollow class=ot-hashtag href=https://plus.google.com/s/%23active>#active</a> youtube views Right now. The only thing she used was pimpmyviews. com﻿",t,uelHwf8o7_U,UC20vb-R_px4CguHzzBPhoyQ,2010-08-05,Eminem - Love The Way You Lie ft. Rihanna,12441625,597028,2488042269
3,Dakota Taylor,2015-05-29,Cool﻿,f,uelHwf8o7_U,UC20vb-R_px4CguHzzBPhoyQ,2010-08-05,Eminem - Love The Way You Lie ft. Rihanna,12441625,597028,2488042269
4,Jihad Naser,,Hello I&#39;am from Palastine﻿,t,uelHwf8o7_U,UC20vb-R_px4CguHzzBPhoyQ,2010-08-05,Eminem - Love The Way You Lie ft. Rihanna,12441625,597028,2488042269
5,Darrion Johnson,2015-05-29,Wow this video almost has a billion views! Didn&#39;t know it was so popular ﻿,f,uelHwf8o7_U,UC20vb-R_px4CguHzzBPhoyQ,2010-08-05,Eminem - Love The Way You Lie ft. Rihanna,12441625,597028,2488042269
6,kyeman13,,Go check out my rapping video called Four Wheels please ❤️﻿,t,uelHwf8o7_U,UC20vb-R_px4CguHzzBPhoyQ,2010-08-05,Eminem - Love The Way You Lie ft. Rihanna,12441625,597028,2488042269
7,Damax,2015-05-29,Almost 1 billion﻿,f,uelHwf8o7_U,UC20vb-R_px4CguHzzBPhoyQ,2010-08-05,Eminem - Love The Way You Lie ft. Rihanna,12441625,597028,2488042269
8,Muhammad Asim Mansha,,Aslamu Lykum... From Pakistan﻿,t,uelHwf8o7_U,UC20vb-R_px4CguHzzBPhoyQ,2010-08-05,Eminem - Love The Way You Lie ft. Rihanna,12441625,597028,2488042269
9,JuanPa Rap,2015-05-28,Eminem is idol for very people in España and Mexico or Latinoamerica﻿,f,uelHwf8o7_U,UC20vb-R_px4CguHzzBPhoyQ,2010-08-05,Eminem - Love The Way You Lie ft. Rihanna,12441625,597028,2488042269
10,Mjt12,,Help me get 50 subs please ﻿,t,uelHwf8o7_U,UC20vb-R_px4CguHzzBPhoyQ,2010-08-05,Eminem - Love The Way You Lie ft. Rihanna,12441625,597028,2488042269
11,emily 13,2015-05-28,i love song :)﻿,f,uelHwf8o7_U,UC20vb-R_px4CguHzzBPhoyQ,2010-08-05,Eminem - Love The Way You Lie ft. Rihanna,12441625,597028,2488042269
12,TheJohnRage,,"Alright ladies, if you like this song, then check out John Rage.  He&#39;s a smoking hot rapper coming into the game.  He&#39;s not better than Eminem lyrically, but he&#39;s hotter. Hear some of his songs on my channel.﻿",t,uelHwf8o7_U,UC20vb-R_px4CguHzzBPhoyQ,2010-08-05,Eminem - Love The Way You Lie ft. Rihanna,12441625,597028,2488042269
13,William Davis,2015-05-28,The perfect example of abuse from husbands and the thing is I&#39;m a feminist so I definitely agree with this song and well...if I see this someone&#39;s going to die! Just sayin.﻿,f,uelHwf8o7_U,UC20vb-R_px4CguHzzBPhoyQ,2010-08-05,Eminem - Love The Way You Lie ft. Rihanna,12441625,597028,2488042269
14,Ashleigh_ Baise,2015-05-28,The boyfriend was Charlie from the TV show LOST ﻿,f,uelHwf8o7_U,UC20vb-R_px4CguHzzBPhoyQ,2010-08-05,Eminem - Love The Way You Lie ft. Rihanna,12441625,597028,2488042269
15,Lauralyn Karoll,,<a href=https://www.facebook.com/groups/100877300245414/>https://www.facebook.com/groups/100877300245414/</a>﻿,t,uelHwf8o7_U,UC20vb-R_px4CguHzzBPhoyQ,2010-08-05,Eminem - Love The Way You Lie ft. Rihanna,12441625,597028,2488042269
16,Shirley Lim,,Take a look at this video on YouTube:﻿,t,uelHwf8o7_U,UC20vb-R_px4CguHzzBPhoyQ,2010-08-05,Eminem - Love The Way You Lie ft. Rihanna,12441625,597028,2488042269
17,TMCB production (Instrumental Beats),,Check out our Channel for nice Beats!!﻿,t,uelHwf8o7_U,UC20vb-R_px4CguHzzBPhoyQ,2010-08-05,Eminem - Love The Way You Lie ft. Rihanna,12441625,597028,2488042269
18,Sylith,2015-05-28,Rihanna and Eminem together are unstoppable.﻿,f,uelHwf8o7_U,UC20vb-R_px4CguHzzBPhoyQ,2010-08-05,Eminem - Love The Way You Lie ft. Rihanna,12441625,597028,2488042269
19,nepaladventure,,Check out this playlist on YouTube:﻿,t,uelHwf8o7_U,UC20vb-R_px4CguHzzBPhoyQ,2010-08-05,Eminem - Love The Way You Lie ft. Rihanna,12441625,597028,2488042269
20,Pugnsuit,2015-05-28,This song is about Rape and Cheating     <br /><br /><br /><br /><br /><br /><br /><br /><br /><br />Basically.....﻿,f,uelHwf8o7_U,UC20vb-R_px4CguHzzBPhoyQ,2010-08-05,Eminem - Love The Way You Lie ft. Rihanna,12441625,597028,2488042269
21,Inga Lomidze,,like please﻿,t,uelHwf8o7_U,UC20vb-R_px4CguHzzBPhoyQ,2010-08-05,Eminem - Love The Way You Lie ft. Rihanna,12441625,597028,2488042269
22,Izana,2015-05-28,"I love this song, can&#39;t believe it was 5 years ago, it doesn&#39;t get old though﻿",f,uelHwf8o7_U,UC20vb-R_px4CguHzzBPhoyQ,2010-08-05,Eminem - Love The Way You Lie ft. Rihanna,12441625,597028,2488042269
23,Daniel Klous,2015-05-28,OMG that looks just like a piece of the mirror of harry potter and the deathly hallows.<br />Either that house. (sirius black)﻿,f,uelHwf8o7_U,UC20vb-R_px4CguHzzBPhoyQ,2010-08-05,Eminem - Love The Way You Lie ft. Rihanna,12441625,597028,2488042269
24,Martin Gébele MUSIC,,"I shared my first song &quot;I Want You&quot;, and I hope you&#39;ll like it. Take a listen!✌️😊 <a href=https://youtu.be/-YfUY4gKr1c>https://youtu.be/-YfUY4gKr1c</a>﻿",t,uelHwf8o7_U,UC20vb-R_px4CguHzzBPhoyQ,2010-08-05,Eminem - Love The Way You Lie ft. Rihanna,12441625,597028,2488042269
25,Crudgy,,Come and check out my music!Im spamming on loads of videos but its just to try and get my music across to new people﻿,t,uelHwf8o7_U,UC20vb-R_px4CguHzzBPhoyQ,2010-08-05,Eminem - Love The Way You Lie ft. Rihanna,12441625,597028,2488042269
26,Joyce Jones,,Check out this playlist on YouTube:﻿,t,uelHwf8o7_U,UC20vb-R_px4CguHzzBPhoyQ,2010-08-05,Eminem - Love The Way You Lie ft. Rihanna,12441625,597028,2488042269
27,Hambro,,HUH HYUCK HYUCK IM SPECIAL WHO&#39;S WATCHING THIS IN 2015 IM FROM AUSTRALIA OR SOMETHING GIVE ME ATTENTION PLEASE IM JUST A RAPPER WITH A DREAM IM GONNA SHARE THIS ON GOOGLE PLUS BECAUSE IM SO COOL.﻿,t,uelHwf8o7_U,UC20vb-R_px4CguHzzBPhoyQ,2010-08-05,Eminem - Love The Way You Lie ft. Rihanna,12441625,597028,2488042269
28,LIL TEZ,2015-05-28,"You exactly who u want to be,watching your favourite rappers on tv﻿",f,uelHwf8o7_U,UC20vb-R_px4CguHzzBPhoyQ,2010-08-05,Eminem - Love The Way You Lie ft. Rihanna,12441625,597028,2488042269
29,Maryf,2015-05-28,Rihanna is absolutely gorgeous in this video.﻿,f,uelHwf8o7_U,UC20vb-R_px4CguHzzBPhoyQ,2010-08-05,Eminem - Love The Way You Lie ft. Rihanna,12441625,597028,2488042269
30,There's No Saving Grace (FreakOffLeash),,Check out this video on YouTube:<br /><br />Love this song... It&#39;s all good will never go back that but I&#39;ll always remember the passion but never want to go back to being dysfunctional insanity....... Goal is to live happy not live insane. ﻿,t,uelHwf8o7_U,UC20vb-R_px4CguHzzBPhoyQ,2010-08-05,Eminem - Love The Way You Lie ft. Rihanna,12441625,597028,2488042269
31,Kishore sl,2015-05-28,"Don&#39;t love someone soo much, love the way u lie..﻿",f,uelHwf8o7_U,UC20vb-R_px4CguHzzBPhoyQ,2010-08-05,Eminem - Love The Way You Lie ft. Rihanna,12441625,597028,2488042269
32,Dragon Addict,2015-05-28,one of the BEST SONGS in music history﻿,f,uelHwf8o7_U,UC20vb-R_px4CguHzzBPhoyQ,2010-08-05,Eminem - Love The Way You Lie ft. Rihanna,12441625,597028,2488042269
33,Belinda Mitchell,,Check out this playlist on YouTube:﻿,t,uelHwf8o7_U,UC20vb-R_px4CguHzzBPhoyQ,2010-08-05,Eminem - Love The Way You Lie ft. Rihanna,12441625,597028,2488042269
34,Klaudia Marysol,,Check out this video on YouTube:﻿,t,uelHwf8o7_U,UC20vb-R_px4CguHzzBPhoyQ,2010-08-05,Eminem - Love The Way You Lie ft. Rihanna,12441625,597028,2488042269
35,Rachael Knapp,,Check out this video on YouTube:﻿,t,uelHwf8o7_U,UC20vb-R_px4CguHzzBPhoyQ,2010-08-05,Eminem - Love The Way You Lie ft. Rihanna,12441625,597028,2488042269
36,susie johnson,2015-05-28,No-I hate The Way U LIe!!﻿,f,uelHwf8o7_U,UC20vb-R_px4CguHzzBPhoyQ,2010-08-05,Eminem - Love The Way You Lie ft. Rihanna,12441625,597028,2488042269
37,Playboy 808,2015-05-28,Fuck Eminem. Bieber is the best &lt;3﻿,f,uelHwf8o7_U,UC20vb-R_px4CguHzzBPhoyQ,2010-08-05,Eminem - Love The Way You Lie ft. Rihanna,12441625,597028,2488042269
38,Melissa Erhart,,Check out this playlist on YouTube:chcfcvzfzfbvzdr﻿,t,uelHwf8o7_U,UC20vb-R_px4CguHzzBPhoyQ,2010-08-05,Eminem - Love The Way You Lie ft. Rihanna,12441625,597028,2488042269
39,melissa delaney,,Check out this playlist on YouTube: ﻿,t,uelHwf8o7_U,UC20vb-R_px4CguHzzBPhoyQ,2010-08-05,Eminem - Love The Way You Lie ft. Rihanna,12441625,597028,2488042269
40,Ben Romanucci,,Im gonna share a little ryhme canibus blows eminem away a quadrillion times especially about the categories of intelligent things in his mind. That he learned and rapped about and forgot before eminem spit his first ryme.luv ya linz 4e﻿,t,uelHwf8o7_U,UC20vb-R_px4CguHzzBPhoyQ,2010-08-05,Eminem - Love The Way You Lie ft. Rihanna,12441625,597028,2488042269
41,kevin alvarado,,Check out this video on YouTube:﻿,t,uelHwf8o7_U,UC20vb-R_px4CguHzzBPhoyQ,2010-08-05,Eminem - Love The Way You Lie ft. Rihanna,12441625,597028,2488042269
42,mona lavallee,,Check out this video on YouTube<br /><br /><br />﻿,t,uelHwf8o7_U,UC20vb-R_px4CguHzzBPhoyQ,2010-08-05,Eminem - Love The Way You Lie ft. Rihanna,12441625,597028,2488042269
43,Daniel Wagemans,,CHECK OUT THE NEW REMIX !!!<br />CLICK CLICK !!﻿,t,uelHwf8o7_U,UC20vb-R_px4CguHzzBPhoyQ,2010-08-05,Eminem - Love The Way You Lie ft. Rihanna,12441625,597028,2488042269
44,Greg Porter,,Check out this playlist on YouTube:﻿,t,uelHwf8o7_U,UC20vb-R_px4CguHzzBPhoyQ,2010-08-05,Eminem - Love The Way You Lie ft. Rihanna,12441625,597028,2488042269
124,DanteBTV,,Check Out The New Hot Video By Dante B Called Riled Up,t,uelHwf8o7_U,UC20vb-R_px4CguHzzBPhoyQ,2010-08-05,Eminem - Love The Way You Lie ft. Rihanna,12441625,597028,2488042269
45,Chris Faith,,I personally have never been in a abusive relationship. I probably never will. I don&#39;t hit women. Mom has my dad used to hit my mom before he left. I can relate I&#39;m writing about one at the moment subscribe to hear it. EVERY fan counts.﻿,t,uelHwf8o7_U,UC20vb-R_px4CguHzzBPhoyQ,2010-08-05,Eminem - Love The Way You Lie ft. Rihanna,12441625,597028,2488042269
46,sonia prudencio,2015-05-28,Love😘❤💖﻿,f,uelHwf8o7_U,UC20vb-R_px4CguHzzBPhoyQ,2010-08-05,Eminem - Love The Way You Lie ft. Rihanna,12441625,597028,2488042269
47,Romulus IV,2015-05-28,"Haha, I can&#39;t believe how many kids listen to Eminem.  You kids know that he does drugs and ends high in jail. I wonder why he never ended OD. ﻿",f,uelHwf8o7_U,UC20vb-R_px4CguHzzBPhoyQ,2010-08-05,Eminem - Love The Way You Lie ft. Rihanna,12441625,597028,2488042269
48,awsome models,,plese subscribe to me﻿,t,uelHwf8o7_U,UC20vb-R_px4CguHzzBPhoyQ,2010-08-05,Eminem - Love The Way You Lie ft. Rihanna,12441625,597028,2488042269
49,Kyle Joyce,,Check out this video on YouTube:﻿,t,uelHwf8o7_U,UC20vb-R_px4CguHzzBPhoyQ,2010-08-05,Eminem - Love The Way You Lie ft. Rihanna,12441625,597028,2488042269
50,CypherBrothers,,"Aye homies check out our remix to 50 Cent Your Life Is On The Line we just started our youtube channel and we are all ways working hard, give us some feed back on our latest song on what you guys think if you like show support.﻿",t,uelHwf8o7_U,UC20vb-R_px4CguHzzBPhoyQ,2010-08-05,Eminem - Love The Way You Lie ft. Rihanna,12441625,597028,2488042269
51,Lynda Johnson,2015-05-28,this is the 2nd most best song when im gone by m&amp;m﻿,f,uelHwf8o7_U,UC20vb-R_px4CguHzzBPhoyQ,2010-08-05,Eminem - Love The Way You Lie ft. Rihanna,12441625,597028,2488042269
52,Bryan Carter,,Check out this video on YouTube:﻿,t,uelHwf8o7_U,UC20vb-R_px4CguHzzBPhoyQ,2010-08-05,Eminem - Love The Way You Lie ft. Rihanna,12441625,597028,2488042269
53,Bo Lanciné MAGASSOUBA,2015-05-28,"WE GO FOR 1,000,000,000 FOR EMINEM﻿",f,uelHwf8o7_U,UC20vb-R_px4CguHzzBPhoyQ,2010-08-05,Eminem - Love The Way You Lie ft. Rihanna,12441625,597028,2488042269
54,Supernatural Kubilay,2015-05-28,Eminem and Rihanna sing the song very well.﻿,f,uelHwf8o7_U,UC20vb-R_px4CguHzzBPhoyQ,2010-08-05,Eminem - Love The Way You Lie ft. Rihanna,12441625,597028,2488042269
55,Bilinmeyenin Bilinmeyeni,,Subscribe me Secret videos :D﻿,t,uelHwf8o7_U,UC20vb-R_px4CguHzzBPhoyQ,2010-08-05,Eminem - Love The Way You Lie ft. Rihanna,12441625,597028,2488042269
56,Janie Musgrove,,Check out this video on YouTube:﻿,t,uelHwf8o7_U,UC20vb-R_px4CguHzzBPhoyQ,2010-08-05,Eminem - Love The Way You Lie ft. Rihanna,12441625,597028,2488042269
57,Karen Cook,,Check out this video on YouTube:but I&#39;m not Rhinnah﻿,t,uelHwf8o7_U,UC20vb-R_px4CguHzzBPhoyQ,2010-08-05,Eminem - Love The Way You Lie ft. Rihanna,12441625,597028,2488042269
58,ultimatecleanmusic,,Subscribe to me for clean Eminem!,t,uelHwf8o7_U,UC20vb-R_px4CguHzzBPhoyQ,2010-08-05,Eminem - Love The Way You Lie ft. Rihanna,12441625,597028,2488042269
59,DJ ROY,," Hey youtubers... {**}I really appreciate all of you who took the time, to read this, I am just a 19 year old boy who wants to be a successful musician in the           music world. {**}I dont have any money to advertise my channel, {**}If you could just visit my channel, comment on my video or subscribe, that would be great.... {**}It will only be few seconds of your life..... {**}Thank u to all the people who just gave me a chance l really appreciate it ",t,uelHwf8o7_U,UC20vb-R_px4CguHzzBPhoyQ,2010-08-05,Eminem - Love The Way You Lie ft. Rihanna,12441625,597028,2488042269
60,Puan Sha Zamri,2015-05-28,LOVE THE WAY YOU LIE ..&quot;﻿,f,uelHwf8o7_U,UC20vb-R_px4CguHzzBPhoyQ,2010-08-05,Eminem - Love The Way You Lie ft. Rihanna,12441625,597028,2488042269
61,andrewregino1,,Check out this video on YouTube:﻿,t,uelHwf8o7_U,UC20vb-R_px4CguHzzBPhoyQ,2010-08-05,Eminem - Love The Way You Lie ft. Rihanna,12441625,597028,2488042269
62,Pedazo Astur,,This guy win dollars sleeping... m m m he loves the planet its full of RETARDS,t,uelHwf8o7_U,UC20vb-R_px4CguHzzBPhoyQ,2010-08-05,Eminem - Love The Way You Lie ft. Rihanna,12441625,597028,2488042269
63,A Way With Words,,Check out our cover of this song!,t,uelHwf8o7_U,UC20vb-R_px4CguHzzBPhoyQ,2010-08-05,Eminem - Love The Way You Lie ft. Rihanna,12441625,597028,2488042269
64,Louis Serano,,Check out this video on YouTube:﻿,t,uelHwf8o7_U,UC20vb-R_px4CguHzzBPhoyQ,2010-08-05,Eminem - Love The Way You Lie ft. Rihanna,12441625,597028,2488042269
65,Muhamat Agus,2015-05-28,goot﻿,f,uelHwf8o7_U,UC20vb-R_px4CguHzzBPhoyQ,2010-08-05,Eminem - Love The Way You Lie ft. Rihanna,12441625,597028,2488042269
66,iSmartKid,2015-05-28,2015 but Im still listening to this!﻿,f,uelHwf8o7_U,UC20vb-R_px4CguHzzBPhoyQ,2010-08-05,Eminem - Love The Way You Lie ft. Rihanna,12441625,597028,2488042269
67,Jodie Jackson,2015-05-28,"How is this the most watched Eminem video, it beats not afraid? ﻿",f,uelHwf8o7_U,UC20vb-R_px4CguHzzBPhoyQ,2010-08-05,Eminem - Love The Way You Lie ft. Rihanna,12441625,597028,2488042269
68,themagicmangotree,,Check out my channel for funny skits! Thanks!,t,uelHwf8o7_U,UC20vb-R_px4CguHzzBPhoyQ,2010-08-05,Eminem - Love The Way You Lie ft. Rihanna,12441625,597028,2488042269
69,AllDailyVines,,hahahahah ♥♥♥♥ :D like vines ?  Subscribe to me for daily vines,t,uelHwf8o7_U,UC20vb-R_px4CguHzzBPhoyQ,2010-08-05,Eminem - Love The Way You Lie ft. Rihanna,12441625,597028,2488042269
70,Samantha Sawyer,,please read this please! i am a country singer who is trying to become someone. so if you would like my videos please. just type... boys round here by country girl (only on computer) wasting all these tears e.t. please subscribe and like,t,uelHwf8o7_U,UC20vb-R_px4CguHzzBPhoyQ,2010-08-05,Eminem - Love The Way You Lie ft. Rihanna,12441625,597028,2488042269
71,Tajuanna Davis,,Check out this video on YouTube:﻿,t,uelHwf8o7_U,UC20vb-R_px4CguHzzBPhoyQ,2010-08-05,Eminem - Love The Way You Lie ft. Rihanna,12441625,597028,2488042269
72,FreshX,,"GUYS SHARE THIS VIDEO!!!!!  HE must have 1.000.000.000 views  Share on Facebook, groups, pages!!",t,uelHwf8o7_U,UC20vb-R_px4CguHzzBPhoyQ,2010-08-05,Eminem - Love The Way You Lie ft. Rihanna,12441625,597028,2488042269
73,Wild 'N' Out,,CHECK OUT Eminem - Rap God LYRIC VIDEO,t,uelHwf8o7_U,UC20vb-R_px4CguHzzBPhoyQ,2010-08-05,Eminem - Love The Way You Lie ft. Rihanna,12441625,597028,2488042269
74,Alura Patterson,2015-05-28,Love this song﻿,f,uelHwf8o7_U,UC20vb-R_px4CguHzzBPhoyQ,2010-08-05,Eminem - Love The Way You Lie ft. Rihanna,12441625,597028,2488042269
75,Cristian Sepulveda,2015-05-28,"Rihana, Love Me. :(﻿",f,uelHwf8o7_U,UC20vb-R_px4CguHzzBPhoyQ,2010-08-05,Eminem - Love The Way You Lie ft. Rihanna,12441625,597028,2488042269
76,Michael J. Cabose,,like this comment then type 1337,t,uelHwf8o7_U,UC20vb-R_px4CguHzzBPhoyQ,2010-08-05,Eminem - Love The Way You Lie ft. Rihanna,12441625,597028,2488042269
77,RoyEpperson,2015-05-28,Is that Charlie from lost?<br />﻿,f,uelHwf8o7_U,UC20vb-R_px4CguHzzBPhoyQ,2010-08-05,Eminem - Love The Way You Lie ft. Rihanna,12441625,597028,2488042269
78,TheSkullcrusher73,2015-05-28,who the fuck cheats on megan fox﻿,f,uelHwf8o7_U,UC20vb-R_px4CguHzzBPhoyQ,2010-08-05,Eminem - Love The Way You Lie ft. Rihanna,12441625,597028,2488042269
79,Sebastian Martinez,2015-05-27,that is megan fox﻿,f,uelHwf8o7_U,UC20vb-R_px4CguHzzBPhoyQ,2010-08-05,Eminem - Love The Way You Lie ft. Rihanna,12441625,597028,2488042269
80,Febe Gonzalez,2015-05-27,I love music﻿,f,uelHwf8o7_U,UC20vb-R_px4CguHzzBPhoyQ,2010-08-05,Eminem - Love The Way You Lie ft. Rihanna,12441625,597028,2488042269
81,Michael J. Cabose,,like this comment then type 1337,t,uelHwf8o7_U,UC20vb-R_px4CguHzzBPhoyQ,2010-08-05,Eminem - Love The Way You Lie ft. Rihanna,12441625,597028,2488042269
82,Laura Da Silva,2015-05-27,❤❤❤❤❤❤❤﻿,f,uelHwf8o7_U,UC20vb-R_px4CguHzzBPhoyQ,2010-08-05,Eminem - Love The Way You Lie ft. Rihanna,12441625,597028,2488042269
83,Bayern Franken,2015-05-27,"hot,hot﻿",f,uelHwf8o7_U,UC20vb-R_px4CguHzzBPhoyQ,2010-08-05,Eminem - Love The Way You Lie ft. Rihanna,12441625,597028,2488042269
84,Tyler Gilman,,Check out this video on YouTube:﻿,t,uelHwf8o7_U,UC20vb-R_px4CguHzzBPhoyQ,2010-08-05,Eminem - Love The Way You Lie ft. Rihanna,12441625,597028,2488042269
85,ViperFoe,,"Wow justin Bieber is Better  thats why when he buys medication he always shares with his half wited money alfred but sadly enough he is an attention hog with swamp ass and an eating disorder filled with sassy mice, and flaming hot cheetos that he can eat with the power of the samurman.",t,uelHwf8o7_U,UC20vb-R_px4CguHzzBPhoyQ,2010-08-05,Eminem - Love The Way You Lie ft. Rihanna,12441625,597028,2488042269
86,Jimmy Hopkins,2015-05-27,this fucking song like a&#39;n oreo the only white part is the good 1﻿,f,uelHwf8o7_U,UC20vb-R_px4CguHzzBPhoyQ,2010-08-05,Eminem - Love The Way You Lie ft. Rihanna,12441625,597028,2488042269
87,Dale Sullivan,2015-05-27,"no where near one of eminems actual best songs, real fans know what im talking about: Untitled, cold wind blows, welcome 2 hell, elevator, business, wtp, almost famous, 25 to life, rock bottom, no apologies, same song and dance, without me, way i am, toy soldiers, mosh and insane &lt; songs off the top of my head that&#39;s better﻿",f,uelHwf8o7_U,UC20vb-R_px4CguHzzBPhoyQ,2010-08-05,Eminem - Love The Way You Lie ft. Rihanna,12441625,597028,2488042269
125,Zach Myers,2015-05-26,I hate rap and I like this song﻿,f,uelHwf8o7_U,UC20vb-R_px4CguHzzBPhoyQ,2010-08-05,Eminem - Love The Way You Lie ft. Rihanna,12441625,597028,2488042269
126,Chris Edgar,2015-05-26,Love the way you lie - Driveshaft﻿,f,uelHwf8o7_U,UC20vb-R_px4CguHzzBPhoyQ,2010-08-05,Eminem - Love The Way You Lie ft. Rihanna,12441625,597028,2488042269
88,volleyballspikerable,,"Finally someone shares the same opinion as me. I&#39;ve tried really hard to like Gangnam style but I just can&#39;t, I don&#39;t even get the dance either. A song like this should be more popular than Gangnam Style, at least it makes sense.",t,uelHwf8o7_U,UC20vb-R_px4CguHzzBPhoyQ,2010-08-05,Eminem - Love The Way You Lie ft. Rihanna,12441625,597028,2488042269
89,DanteBTV,,Check Out The New Hot Video By Dante B Called Riled Up,t,uelHwf8o7_U,UC20vb-R_px4CguHzzBPhoyQ,2010-08-05,Eminem - Love The Way You Lie ft. Rihanna,12441625,597028,2488042269
90,DanteBTV,,Check Out The New Hot Video By Dante B Called Riled Up,t,uelHwf8o7_U,UC20vb-R_px4CguHzzBPhoyQ,2010-08-05,Eminem - Love The Way You Lie ft. Rihanna,12441625,597028,2488042269
91,Ali Baza,2015-05-27,"Still listening,still same pleasure﻿",f,uelHwf8o7_U,UC20vb-R_px4CguHzzBPhoyQ,2010-08-05,Eminem - Love The Way You Lie ft. Rihanna,12441625,597028,2488042269
92,Josephine Monti,,▌▌▌▌▌▌▌▌▌▌▌▌▌▌▌▌▌▌▌▌▌▌▌▌▌▌▌▌▌▌▌▌▌▌▌▌▌▌▌▌▌▌▌▌▌▌▌▌▌▌▌▌▌▌▌▌ FACEBOOK PASSWORD HACK 2013! facebook-pass-hack2013.blogspot.com ONLY 100% WORKING SOFTWARE FOR HACKING ANY FACEBOOK PASSWORD! It&#39;s FREE for download and breaks any password in 10-15 minutes! 100% virus free! For details and FREE DOWNLOAD please visit facebook-pass-hack2013.blogspot.com ▌▌▌▌▌▌▌▌▌▌▌▌▌▌▌▌▌▌▌▌▌▌▌▌▌▌▌▌▌▌▌▌▌▌▌▌▌▌▌▌▌▌▌▌▌▌▌▌▌▌▌▌▌▌▌▌,t,uelHwf8o7_U,UC20vb-R_px4CguHzzBPhoyQ,2010-08-05,Eminem - Love The Way You Lie ft. Rihanna,12441625,597028,2488042269
93,Aurora Calvanelli,2015-05-27,I love you!❤✨﻿,f,uelHwf8o7_U,UC20vb-R_px4CguHzzBPhoyQ,2010-08-05,Eminem - Love The Way You Lie ft. Rihanna,12441625,597028,2488042269
94,LXZNY,2015-05-27,2010? The time past so fast ..﻿,f,uelHwf8o7_U,UC20vb-R_px4CguHzzBPhoyQ,2010-08-05,Eminem - Love The Way You Lie ft. Rihanna,12441625,597028,2488042269
95,Dakoda Bigelow,,"Hey everyone, I&#39;m Dakoda Bigelow.  I&#39;m a 17 year old singer, rapper and producer.  I&#39;ve gained over 490,000 views so far but I really need more views, likes and subscribers in order to make it.  Check out my brand new music video for my song So Gone!  Also check out my new song called Deaf.  A few moments of your time would be greatly appreciated and you won&#39;t regret it :)  Please thumbs this up so more people can see it!  Thanks for the support.",t,uelHwf8o7_U,UC20vb-R_px4CguHzzBPhoyQ,2010-08-05,Eminem - Love The Way You Lie ft. Rihanna,12441625,597028,2488042269
96,ankan412,2015-05-27,#2015 FUCK YEAH﻿,f,uelHwf8o7_U,UC20vb-R_px4CguHzzBPhoyQ,2010-08-05,Eminem - Love The Way You Lie ft. Rihanna,12441625,597028,2488042269
97,UserGamer51 _,2015-05-27,eminem is a ginius stop!﻿,f,uelHwf8o7_U,UC20vb-R_px4CguHzzBPhoyQ,2010-08-05,Eminem - Love The Way You Lie ft. Rihanna,12441625,597028,2488042269
98,Fill Reseni,2015-05-27,The rap: cool     Rihanna: STTUUPID﻿,f,uelHwf8o7_U,UC20vb-R_px4CguHzzBPhoyQ,2010-08-05,Eminem - Love The Way You Lie ft. Rihanna,12441625,597028,2488042269
99,Amer Amer,2015-05-27,Just gonna stand there and hear me cry ..﻿,f,uelHwf8o7_U,UC20vb-R_px4CguHzzBPhoyQ,2010-08-05,Eminem - Love The Way You Lie ft. Rihanna,12441625,597028,2488042269
100,AliBerk Özer,2015-05-27,Love﻿,f,uelHwf8o7_U,UC20vb-R_px4CguHzzBPhoyQ,2010-08-05,Eminem - Love The Way You Lie ft. Rihanna,12441625,597028,2488042269
101,King Kunta,2015-05-27,Feels and emotions in this song...God damn﻿,f,uelHwf8o7_U,UC20vb-R_px4CguHzzBPhoyQ,2010-08-05,Eminem - Love The Way You Lie ft. Rihanna,12441625,597028,2488042269
102,Joden Brett,,all u should go check out j rants vi about eminem,t,uelHwf8o7_U,UC20vb-R_px4CguHzzBPhoyQ,2010-08-05,Eminem - Love The Way You Lie ft. Rihanna,12441625,597028,2488042269
103,GB REEFAT,2015-05-27,MEGAN FOX AND EMINEM TOGETHER IN A VIDEO  DOESNT GET BETTER THAN THAT﻿,f,uelHwf8o7_U,UC20vb-R_px4CguHzzBPhoyQ,2010-08-05,Eminem - Love The Way You Lie ft. Rihanna,12441625,597028,2488042269
104,char mcleod,,Check out this video on YouTube: <a rel=nofollow class=ot-hashtag href=https://plus.google.com/s/%23Eminem>#Eminem</a> <a rel=nofollow class=ot-hashtag href=https://plus.google.com/s/%23Lovethewayyoulie>#Lovethewayyoulie</a> <a rel=nofollow class=ot-hashtag href=https://plus.google.com/s/%23RapGod>#RapGod</a> <a rel=nofollow class=ot-hashtag href=https://plus.google.com/s/%23King>#King</a> ﻿,t,uelHwf8o7_U,UC20vb-R_px4CguHzzBPhoyQ,2010-08-05,Eminem - Love The Way You Lie ft. Rihanna,12441625,597028,2488042269
105,101Tele,,"yo I know nobody will probably even read this..  But I’m gonna type it any way because i hope at least one person will  i&#39;m a rapper with a dream. I know there&#39;s like 200k of those in this world  but please check out my music and subscribe? if you want.? thanks,  I would love nothing more than to have a decent following on youtube..  if anyone? reading this could press the &quot;THUMBS UP&quot; other people will see it  just a simple button press? could make my dream come true =) Thank You",t,uelHwf8o7_U,UC20vb-R_px4CguHzzBPhoyQ,2010-08-05,Eminem - Love The Way You Lie ft. Rihanna,12441625,597028,2488042269
106,leslie mendoza,2015-05-27,best song﻿,f,uelHwf8o7_U,UC20vb-R_px4CguHzzBPhoyQ,2010-08-05,Eminem - Love The Way You Lie ft. Rihanna,12441625,597028,2488042269
107,real money,, subscribe to my feed,t,uelHwf8o7_U,UC20vb-R_px4CguHzzBPhoyQ,2010-08-05,Eminem - Love The Way You Lie ft. Rihanna,12441625,597028,2488042269
108,SlimShadyPG,,"EVERYONE GO AND SHARE youtu  be/ARkglzjQuP0 ON FB,TWITTER,G+ TO VOTE FOR EMINEM TO BECOME ARTIST OF THE YEAR ON FIRST EVER YOUTUBE MUSIC AWARDS !!!  AND GET THIS METHOD TO CHEAT AT INTERNET ROULETTE OUT OF EMINEMS VIDEO ! SHADY ARTIST OF THE YEAR !",t,uelHwf8o7_U,UC20vb-R_px4CguHzzBPhoyQ,2010-08-05,Eminem - Love The Way You Lie ft. Rihanna,12441625,597028,2488042269
