id,author,date,content,class,video_id,channel_id,date_published,video_title,like_count,comment_count,view_count
138,MrCollinGabriel,2014-09-20,"This is fucking shit. From the first notes, that becomes clear. Complete  and utter shit. May God come and cleanse the earth of the complete and  utter idiocy which is humankind.﻿",f,CevxZvSJLk8,UC-8Q-hLdECwQmaWNwXitYDw,2013-09-05,Katy Perry - Roar (Official),15586013,760708,3673686440
137,Darth Vaderbro,2014-09-20,If interested in making extra money by internet use the next link www.swagbucks.com/refer/Nonturtle02﻿,t,CevxZvSJLk8,UC-8Q-hLdECwQmaWNwXitYDw,2013-09-05,Katy Perry - Roar (Official),15586013,760708,3673686440
136,roflcopter2110,2014-09-19,http://thepiratebay.se/torrent/10626048/The.Expendables.3.2014.DVDScr.LEAKED.CLEAN.XviD.MP3-RARBG ﻿,t,CevxZvSJLk8,UC-8Q-hLdECwQmaWNwXitYDw,2013-09-05,Katy Perry - Roar (Official),15586013,760708,3673686440
135,roflcopter2110,2014-09-19,http://thepiratebay.se/torrent/10626835/The.Expendables.3.2014.DVDSCR.Xvid-DiNGO ﻿,t,CevxZvSJLk8,UC-8Q-hLdECwQmaWNwXitYDw,2013-09-05,Katy Perry - Roar (Official),15586013,760708,3673686440
134,Kaida Tong,2014-09-19,"Since she is a feminist champion, why would she want to reinforce the  stereotype of girls being girly by painting the nails of an elephant that  probably wouldn''t even appreciate it?﻿",f,CevxZvSJLk8,UC-8Q-hLdECwQmaWNwXitYDw,2013-09-05,Katy Perry - Roar (Official),15586013,760708,3673686440
133,Tushti Chakraborty,2014-09-19,I &lt;3 Katy Perry!﻿,f,CevxZvSJLk8,UC-8Q-hLdECwQmaWNwXitYDw,2013-09-05,Katy Perry - Roar (Official),15586013,760708,3673686440
132,J MP,2014-09-19,https://viralangels.com/user/d4aaacwk﻿,t,CevxZvSJLk8,UC-8Q-hLdECwQmaWNwXitYDw,2013-09-05,Katy Perry - Roar (Official),15586013,760708,3673686440
131,Emma C,2014-09-18,i am a big fan of you and i love you﻿,f,CevxZvSJLk8,UC-8Q-hLdECwQmaWNwXitYDw,2013-09-05,Katy Perry - Roar (Official),15586013,760708,3673686440
130,Ari4Cortez5Ortiz 9Uria,2014-09-18,Katty perry please say in one of your new videoes that they follow the  Girls Girls please﻿,t,CevxZvSJLk8,UC-8Q-hLdECwQmaWNwXitYDw,2013-09-05,Katy Perry - Roar (Official),15586013,760708,3673686440
129,Pettrus Ortega,2014-09-18,"THIS IS A COMPETITION TO MEET MY IDOLS, IT WOULD MEAN SO MUCH IF YOU GUYS  WILL LIKE THIS PIC ON IG! http://instagram.com/p/smZdivopxb/﻿",t,CevxZvSJLk8,UC-8Q-hLdECwQmaWNwXitYDw,2013-09-05,Katy Perry - Roar (Official),15586013,760708,3673686440
128,Vena Veno,2014-09-17,She loves Vena. trojmiasto.pl/Vena-Bus-Taxi-o59253.html﻿,t,CevxZvSJLk8,UC-8Q-hLdECwQmaWNwXitYDw,2013-09-05,Katy Perry - Roar (Official),15586013,760708,3673686440
127,DatoJason Jason,2014-09-17,It is a shit﻿,f,CevxZvSJLk8,UC-8Q-hLdECwQmaWNwXitYDw,2013-09-05,Katy Perry - Roar (Official),15586013,760708,3673686440
126,Chris Madzier,2014-09-16,Your going to hear me Roar !!!! :-))))   #soundsofsunday ﻿,f,CevxZvSJLk8,UC-8Q-hLdECwQmaWNwXitYDw,2013-09-05,Katy Perry - Roar (Official),15586013,760708,3673686440
125,Mandeep Kaur,2014-09-16,selfie alert﻿,f,CevxZvSJLk8,UC-8Q-hLdECwQmaWNwXitYDw,2013-09-05,Katy Perry - Roar (Official),15586013,760708,3673686440
124,Harrison Lloyd,2014-09-16,Imagine this in the news crazy woman found acting like a tiger and bit jims  ear off﻿,f,CevxZvSJLk8,UC-8Q-hLdECwQmaWNwXitYDw,2013-09-05,Katy Perry - Roar (Official),15586013,760708,3673686440
123,Nathan Waterhouse,2014-09-16,Please check out my acoustic cover channel :) thanks ﻿,t,CevxZvSJLk8,UC-8Q-hLdECwQmaWNwXitYDw,2013-09-05,Katy Perry - Roar (Official),15586013,760708,3673686440
122,Marieke Sp33lma,2014-09-16,Watch my videos xx﻿,t,CevxZvSJLk8,UC-8Q-hLdECwQmaWNwXitYDw,2013-09-05,Katy Perry - Roar (Official),15586013,760708,3673686440
121,Amana Amjad,2014-09-16,Awesum song!! Jus luv it!﻿,f,CevxZvSJLk8,UC-8Q-hLdECwQmaWNwXitYDw,2013-09-05,Katy Perry - Roar (Official),15586013,760708,3673686440
120,Jana Trpevska,2014-09-16,Great.This is a song﻿,f,CevxZvSJLk8,UC-8Q-hLdECwQmaWNwXitYDw,2013-09-05,Katy Perry - Roar (Official),15586013,760708,3673686440
119,Jian Li,2014-09-16,"see it all, human folly right?﻿",f,CevxZvSJLk8,UC-8Q-hLdECwQmaWNwXitYDw,2013-09-05,Katy Perry - Roar (Official),15586013,760708,3673686440
118,Rolando Viray,2014-09-16,This Song Was Good Until It Got Overplayed The Hell Out Of On Radio﻿,f,CevxZvSJLk8,UC-8Q-hLdECwQmaWNwXitYDw,2013-09-05,Katy Perry - Roar (Official),15586013,760708,3673686440
117,Chloe Steiner,2014-09-16,"Katy Perry is part of me Katy Perry is my firework Katy Perry, I love you﻿",f,CevxZvSJLk8,UC-8Q-hLdECwQmaWNwXitYDw,2013-09-05,Katy Perry - Roar (Official),15586013,760708,3673686440
116,Nick M,2014-09-16,https://www.reverbnation.com/slicknick313/songs﻿,t,CevxZvSJLk8,UC-8Q-hLdECwQmaWNwXitYDw,2013-09-05,Katy Perry - Roar (Official),15586013,760708,3673686440
115,Magic Johnson,2014-09-16,Katy Perry is garbage. Rihanna is the best singer in the world. ﻿,f,CevxZvSJLk8,UC-8Q-hLdECwQmaWNwXitYDw,2013-09-05,Katy Perry - Roar (Official),15586013,760708,3673686440
114,jose ramon Bocarejo,2014-09-15,How can this song have 629 million views while there are only 7 million  people in the world?﻿,f,CevxZvSJLk8,UC-8Q-hLdECwQmaWNwXitYDw,2013-09-05,Katy Perry - Roar (Official),15586013,760708,3673686440
113,Alanoud Alsaleh,2014-09-15,"I started hating Katy Perry after finding out that she stole all of the  ideas on her videos  from an old comic book. Yet, her music is catchy. ﻿",f,CevxZvSJLk8,UC-8Q-hLdECwQmaWNwXitYDw,2013-09-05,Katy Perry - Roar (Official),15586013,760708,3673686440
112,LuckyMusiqLive,2014-09-15,Katy has the voice of gold. this video really brings the lyrics to life. I  am a rapper with 25000 subscribers.. thumbs up if you hate when you take a  shit and the water splashes your nuts﻿,t,CevxZvSJLk8,UC-8Q-hLdECwQmaWNwXitYDw,2013-09-05,Katy Perry - Roar (Official),15586013,760708,3673686440
111,Peter Wilkes,2014-09-15,"really want this video to get 1 billion views, would be amazing!﻿",f,CevxZvSJLk8,UC-8Q-hLdECwQmaWNwXitYDw,2013-09-05,Katy Perry - Roar (Official),15586013,760708,3673686440
110,David Sean,2014-09-15,"Hey guys! I''ve made a amazing Smiley T-Shirt.Of all the things you wear,  your expression is the most important and remember all the statistics in  the world can’t measure the warmth of a smile. If you''re a big fan of  T-Shirts and want to gets more happiness, it''s perfect for you.  Check this  out and buy it at www.teespring.com/smiley12 =)) thanks you guys so  much!!! ﻿",t,CevxZvSJLk8,UC-8Q-hLdECwQmaWNwXitYDw,2013-09-05,Katy Perry - Roar (Official),15586013,760708,3673686440
109,Thalia Grace,2014-09-14,This comment will randomly get lot's of likes and replies for no reason. I  also like Jello. Strawberry jello.﻿,f,CevxZvSJLk8,UC-8Q-hLdECwQmaWNwXitYDw,2013-09-05,Katy Perry - Roar (Official),15586013,760708,3673686440
108,Veronica Kkk,2014-09-14,My telephone!﻿,f,CevxZvSJLk8,UC-8Q-hLdECwQmaWNwXitYDw,2013-09-05,Katy Perry - Roar (Official),15586013,760708,3673686440
107,jay cruz,2014-09-14,looooooooooooooooooooovvvvvvvvveeeeeeeeeeee ittttttttttttt﻿,f,CevxZvSJLk8,UC-8Q-hLdECwQmaWNwXitYDw,2013-09-05,Katy Perry - Roar (Official),15586013,760708,3673686440
106,bea boots,2014-09-14,great song you go katy!﻿,f,CevxZvSJLk8,UC-8Q-hLdECwQmaWNwXitYDw,2013-09-05,Katy Perry - Roar (Official),15586013,760708,3673686440
105,Abhi Vats,2014-09-14,Katy Perry You Are Looking Soo PRETTY DAMN CUTE :-* :-*﻿,f,CevxZvSJLk8,UC-8Q-hLdECwQmaWNwXitYDw,2013-09-05,Katy Perry - Roar (Official),15586013,760708,3673686440
104,KatyPerry Queen,2014-09-14,Its almost Katys birthday! October 25th Lets say happy birthday to katy!!! ♥♥♥♥♥♥﻿,f,CevxZvSJLk8,UC-8Q-hLdECwQmaWNwXitYDw,2013-09-05,Katy Perry - Roar (Official),15586013,760708,3673686440
103,Buffo hrdfjiu,2014-09-13,"I really don''t understand how this has 600 million views lol. I''m not  hating or anything, it''s just confusing. ﻿",f,CevxZvSJLk8,UC-8Q-hLdECwQmaWNwXitYDw,2013-09-05,Katy Perry - Roar (Official),15586013,760708,3673686440
102,John Chen,2014-09-13,Boooobs﻿,f,CevxZvSJLk8,UC-8Q-hLdECwQmaWNwXitYDw,2013-09-05,Katy Perry - Roar (Official),15586013,760708,3673686440
101,Jouri Osman,2014-09-13,I love KATY PERRY &lt;3 &lt;3﻿,f,CevxZvSJLk8,UC-8Q-hLdECwQmaWNwXitYDw,2013-09-05,Katy Perry - Roar (Official),15586013,760708,3673686440
100,Steve Gallagher,2014-09-13,Maybe the best music video in the last 15 years? This is how pop music is  done folks!﻿,f,CevxZvSJLk8,UC-8Q-hLdECwQmaWNwXitYDw,2013-09-05,Katy Perry - Roar (Official),15586013,760708,3673686440
99,MyNameIs Leah,2014-09-13,"Hey guys!  Can you please SUBSCRIBE to my channel,because I''m gonna filming a video so  hope you guys like it and thank you so much for you''re support! Xoxo,Leah!  &lt;3 ﻿",t,CevxZvSJLk8,UC-8Q-hLdECwQmaWNwXitYDw,2013-09-05,Katy Perry - Roar (Official),15586013,760708,3673686440
98,Yoshi does Minecraft,2014-09-12,Are those real animals﻿,f,CevxZvSJLk8,UC-8Q-hLdECwQmaWNwXitYDw,2013-09-05,Katy Perry - Roar (Official),15586013,760708,3673686440
97,Technibility,2014-09-12,Great video by a great artist in Katy Perry! Admire her creativity! Check  out our channel for no nonsense mobile tech reviews and comparisons as well  as an iPhone 6 and 6 Plus review and comparison!﻿,t,CevxZvSJLk8,UC-8Q-hLdECwQmaWNwXitYDw,2013-09-05,Katy Perry - Roar (Official),15586013,760708,3673686440
96,ENZOxDV9,2014-09-12,"this video is very inaccurate, a tiger would rip her face of﻿",f,CevxZvSJLk8,UC-8Q-hLdECwQmaWNwXitYDw,2013-09-05,Katy Perry - Roar (Official),15586013,760708,3673686440
95,Cristina Valencia,2014-09-12,"hey guys i really want to go to a katy perry concert so im in this contest  where i need a lot of likes and im loosing :( so please if you could like  this picture it would be very nice, thank you i really want to go to her  concert :) https://www.facebook.com/exagdl/photos/a.936868579660284.1073741943.111719098841907/937732262907249/?type=1&amp;theater ﻿",t,CevxZvSJLk8,UC-8Q-hLdECwQmaWNwXitYDw,2013-09-05,Katy Perry - Roar (Official),15586013,760708,3673686440
94,Analiner Benny,2014-09-12,I love this shit but I disliked it because it's sucks﻿,f,CevxZvSJLk8,UC-8Q-hLdECwQmaWNwXitYDw,2013-09-05,Katy Perry - Roar (Official),15586013,760708,3673686440
93,Dj enderman,2014-09-12,There is 7 bilion poeple on earth Now stop being dumb﻿,f,CevxZvSJLk8,UC-8Q-hLdECwQmaWNwXitYDw,2013-09-05,Katy Perry - Roar (Official),15586013,760708,3673686440
92,Gram Bangla,2014-09-12,WOW VERY NICE CONGRASULATION I LIVE SO MUCH http://en.prothom-alo.com/sport/news/53331/Zimbabwe-A-team-due-in-Dhaka-Wednesday ﻿,t,CevxZvSJLk8,UC-8Q-hLdECwQmaWNwXitYDw,2013-09-05,Katy Perry - Roar (Official),15586013,760708,3673686440
91,SergiBeCa Official,2014-09-12,Can you check my videos please? Don't hate me :( Give me one oportunity﻿,t,CevxZvSJLk8,UC-8Q-hLdECwQmaWNwXitYDw,2013-09-05,Katy Perry - Roar (Official),15586013,760708,3673686440
90,Misael Navarro Leon,2014-09-11,Katy has conqueror's haki &gt;:)﻿,f,CevxZvSJLk8,UC-8Q-hLdECwQmaWNwXitYDw,2013-09-05,Katy Perry - Roar (Official),15586013,760708,3673686440
89,Sheldon Duncombe,2014-09-11,http://www.aaas.org/tech-i/vote#view/25874/2177367 VOTE SHELDON PLEASE  GUYS. GIVE IT 5 STARS. THANKS IN ADVANCE﻿,t,CevxZvSJLk8,UC-8Q-hLdECwQmaWNwXitYDw,2013-09-05,Katy Perry - Roar (Official),15586013,760708,3673686440
88,o olek,2014-09-11,The great mother of the jungle. Sweet and natural. I like her videos.﻿,f,CevxZvSJLk8,UC-8Q-hLdECwQmaWNwXitYDw,2013-09-05,Katy Perry - Roar (Official),15586013,760708,3673686440
87,Ken Santiago,2014-09-11,Roar is without a doubt your best song...feel good song with a message for  everyone. Good job Katy﻿,f,CevxZvSJLk8,UC-8Q-hLdECwQmaWNwXitYDw,2013-09-05,Katy Perry - Roar (Official),15586013,760708,3673686440
86,Walker's.Enchanted.Music.Channel,2014-09-11,"i think they were drunk when they shot the first half of the video and then the sec on half comes in, and her boobs are magically bigger and  she''s more beautiful suddenly, and the dude practically vanishes ﻿",f,CevxZvSJLk8,UC-8Q-hLdECwQmaWNwXitYDw,2013-09-05,Katy Perry - Roar (Official),15586013,760708,3673686440
85,Sofi Duarte,2014-09-10,3:46 so cute!﻿,f,CevxZvSJLk8,UC-8Q-hLdECwQmaWNwXitYDw,2013-09-05,Katy Perry - Roar (Official),15586013,760708,3673686440
84,TheParkourGamingPotato,2014-09-10,subscribe to me﻿,t,CevxZvSJLk8,UC-8Q-hLdECwQmaWNwXitYDw,2013-09-05,Katy Perry - Roar (Official),15586013,760708,3673686440
83,Mättr Valleni,2014-09-10,https://m.facebook.com/story.php?story_fbid=764484966942313&amp;id=754989901225153&amp;ref=stream  gf﻿,t,CevxZvSJLk8,UC-8Q-hLdECwQmaWNwXitYDw,2013-09-05,Katy Perry - Roar (Official),15586013,760708,3673686440
82,Jack lewandowski,2014-09-10,Hi guys i sell Jack Daniel's Hard Back Cover Case for iPhone 5 5S 5C 4S 4   6'' Old Time with only 3 Dollars on Ebay:  http://www.ebay.com/itm/251638183951?ssPageName=STRK:MESELX:IT&amp;_trksid=p3984.m1555.l2649 ﻿,t,CevxZvSJLk8,UC-8Q-hLdECwQmaWNwXitYDw,2013-09-05,Katy Perry - Roar (Official),15586013,760708,3673686440
81,Neo Joey,2014-09-10,Katy perry is and inspirational singer her voice is awesome and I loved her  so much . She achieved music history and I couldn't believe that . Guys if  you could take 1min to go to my channel and watch my first video I would be  greatly thankful for this :) ty guys N katy is still awesome xoxo﻿,t,CevxZvSJLk8,UC-8Q-hLdECwQmaWNwXitYDw,2013-09-05,Katy Perry - Roar (Official),15586013,760708,3673686440
80,Nicolás Jara,2014-09-10,Click For iTunes code http://shhort.com/a?r=0LaviqU2b﻿,t,CevxZvSJLk8,UC-8Q-hLdECwQmaWNwXitYDw,2013-09-05,Katy Perry - Roar (Official),15586013,760708,3673686440
79,YULIOR ZAMORA,2014-09-10,I    loved        it           so       much          because         you          get         to         stand            fear .﻿,f,CevxZvSJLk8,UC-8Q-hLdECwQmaWNwXitYDw,2013-09-05,Katy Perry - Roar (Official),15586013,760708,3673686440
78,Jessy  Riivera,2014-09-10,I love You Katy ♥﻿,f,CevxZvSJLk8,UC-8Q-hLdECwQmaWNwXitYDw,2013-09-05,Katy Perry - Roar (Official),15586013,760708,3673686440
77,Made2Falter,2014-09-09,"Check out our vids, our songs are awesome! And that I guarantee :)﻿",t,CevxZvSJLk8,UC-8Q-hLdECwQmaWNwXitYDw,2013-09-05,Katy Perry - Roar (Official),15586013,760708,3673686440
76,caleb owczarzak,2014-09-09,This looks so fun and it's a good song﻿,f,CevxZvSJLk8,UC-8Q-hLdECwQmaWNwXitYDw,2013-09-05,Katy Perry - Roar (Official),15586013,760708,3673686440
75,moilovemoi,2014-09-09,ROAAAAARRRRRR 🐯🐯🐯﻿,f,CevxZvSJLk8,UC-8Q-hLdECwQmaWNwXitYDw,2013-09-05,Katy Perry - Roar (Official),15586013,760708,3673686440
74,taione88,2014-09-09,Please share and help to my Friend! http://www.gofundme.com/jormis  Thank  you very much!﻿,t,CevxZvSJLk8,UC-8Q-hLdECwQmaWNwXitYDw,2013-09-05,Katy Perry - Roar (Official),15586013,760708,3673686440
73,blondedbythelight703,2014-09-09,She's an old Whore!﻿,f,CevxZvSJLk8,UC-8Q-hLdECwQmaWNwXitYDw,2013-09-05,Katy Perry - Roar (Official),15586013,760708,3673686440
72,Christ Is Risen,2014-09-09,I WILL FINISH THIS DISSERTATION! And I will laugh in its face when I  finish! Roaaarrr =3﻿,f,CevxZvSJLk8,UC-8Q-hLdECwQmaWNwXitYDw,2013-09-05,Katy Perry - Roar (Official),15586013,760708,3673686440
71,snc,2014-09-09,follow me---&gt; https://twitter.com/f0llowshoutouts ﻿,t,CevxZvSJLk8,UC-8Q-hLdECwQmaWNwXitYDw,2013-09-05,Katy Perry - Roar (Official),15586013,760708,3673686440
70,Rahul Thorat,2014-09-09,You gonna hear me ROARRRR.....﻿,f,CevxZvSJLk8,UC-8Q-hLdECwQmaWNwXitYDw,2013-09-05,Katy Perry - Roar (Official),15586013,760708,3673686440
69,jessica durham,2014-09-09,"Please help me give my son a grave.  http://www.gofundme.com/BishopsGraveMarker Or please just share it on your  fb page, I do not have one anymore.﻿",t,CevxZvSJLk8,UC-8Q-hLdECwQmaWNwXitYDw,2013-09-05,Katy Perry - Roar (Official),15586013,760708,3673686440
68,Sofia Aristizabal,2014-09-09,"I loved, she is amazing.. OMG your eyes*_*﻿",f,CevxZvSJLk8,UC-8Q-hLdECwQmaWNwXitYDw,2013-09-05,Katy Perry - Roar (Official),15586013,760708,3673686440
67,Kathy L.,2014-09-08,In my opinion I think you look better with black hair then blond hair : )﻿,f,CevxZvSJLk8,UC-8Q-hLdECwQmaWNwXitYDw,2013-09-05,Katy Perry - Roar (Official),15586013,760708,3673686440
66,Christopher Pete S.,2014-09-07,Subscribe and u are gonna hear me roar ;)﻿,t,CevxZvSJLk8,UC-8Q-hLdECwQmaWNwXitYDw,2013-09-05,Katy Perry - Roar (Official),15586013,760708,3673686440
65,GGSCommunity,2014-09-07,"Like Gorlin-Goltz Syndrome Support Community, you are not alone. https://www.facebook.com/GorlinGoltzSupport﻿",t,CevxZvSJLk8,UC-8Q-hLdECwQmaWNwXitYDw,2013-09-05,Katy Perry - Roar (Official),15586013,760708,3673686440
64,Aemon Sevker,2014-09-07, GO TO MY CHANNEL and check out my written songs﻿,t,CevxZvSJLk8,UC-8Q-hLdECwQmaWNwXitYDw,2013-09-05,Katy Perry - Roar (Official),15586013,760708,3673686440
63,Eder Rodriguez,2014-09-07,katy perry  just stop it and dont do a song i dont like it﻿,f,CevxZvSJLk8,UC-8Q-hLdECwQmaWNwXitYDw,2013-09-05,Katy Perry - Roar (Official),15586013,760708,3673686440
62,tombraiderxXx12,2014-09-07,I'm not a big fan of the song but this video is awesome!﻿,f,CevxZvSJLk8,UC-8Q-hLdECwQmaWNwXitYDw,2013-09-05,Katy Perry - Roar (Official),15586013,760708,3673686440
61,Robert Kim,2014-09-07,"I''m sorry Katy Perry, I was being weird. I still love you &lt;3﻿",f,CevxZvSJLk8,UC-8Q-hLdECwQmaWNwXitYDw,2013-09-05,Katy Perry - Roar (Official),15586013,760708,3673686440
60,Richard Valko,2014-09-07,Follow me watch my videos :) Follow me watch my videos :) Follow me watch  my videos :) Follow me watch my videos :) Follow me watch my videos :)  Follow me watch my videos :) Follow me watch my videos :)﻿,t,CevxZvSJLk8,UC-8Q-hLdECwQmaWNwXitYDw,2013-09-05,Katy Perry - Roar (Official),15586013,760708,3673686440
59,Divergent lover,2014-09-07,http://shhort.com/a?r=Jt2ufxHxc﻿,t,CevxZvSJLk8,UC-8Q-hLdECwQmaWNwXitYDw,2013-09-05,Katy Perry - Roar (Official),15586013,760708,3673686440
58,maurice davis,2014-09-07,If she really did this there she's hardcore﻿,f,CevxZvSJLk8,UC-8Q-hLdECwQmaWNwXitYDw,2013-09-05,Katy Perry - Roar (Official),15586013,760708,3673686440
57,Ricky Smith,2014-09-07,This song makes me want to drink bleach﻿,f,CevxZvSJLk8,UC-8Q-hLdECwQmaWNwXitYDw,2013-09-05,Katy Perry - Roar (Official),15586013,760708,3673686440
56,xhonavsky,2014-09-06,"I love this song, it´s for empowering every woman :)  you´re gonna hear me roar ;)﻿",f,CevxZvSJLk8,UC-8Q-hLdECwQmaWNwXitYDw,2013-09-05,Katy Perry - Roar (Official),15586013,760708,3673686440
55,Kasia Hill,2014-09-06,http://shhort.com/a?r=G8iX5cTKd﻿,t,CevxZvSJLk8,UC-8Q-hLdECwQmaWNwXitYDw,2013-09-05,Katy Perry - Roar (Official),15586013,760708,3673686440
54,VitalXtreme,2014-09-04,YAY IM THE 11TH COMMENTER!!!!!                                    IF YOUR  CRAZY PLEASE DONATE BITCOINS TO ME AT: 1FHeNqx1twqM153v2PTAyieJNEALAhZvEM﻿,t,CevxZvSJLk8,UC-8Q-hLdECwQmaWNwXitYDw,2013-09-05,Katy Perry - Roar (Official),15586013,760708,3673686440
53,Braiden Short,2014-09-03,http://shhort.com/a?r=HuPwEH5ab﻿,t,CevxZvSJLk8,UC-8Q-hLdECwQmaWNwXitYDw,2013-09-05,Katy Perry - Roar (Official),15586013,760708,3673686440
52,Santeri Saariokari,2014-09-03,Hey guys go to check my video name growtopia my story﻿,t,CevxZvSJLk8,UC-8Q-hLdECwQmaWNwXitYDw,2013-09-05,Katy Perry - Roar (Official),15586013,760708,3673686440
51,Yerki el duro,2014-09-03,Nicee!!sabrosura viva https://soundcloud.com/yerki-elinmigrante/yerki-myb-move-your-body﻿,t,CevxZvSJLk8,UC-8Q-hLdECwQmaWNwXitYDw,2013-09-05,Katy Perry - Roar (Official),15586013,760708,3673686440
50,TWIN MELODY,2014-09-02,"  HI!:D!:) We’ re TWIN MELODY ,17 year old twins :) WE DID SOME COVERS!!WE DID A COVER OF BIRTHDAY BY KATY PERRY!!  PLEASE JUST TAKE 1 SECOND AND WATCH IT!! THANKS,MERCI,GRACIAS,DANKE,OBRIGADO,GRAZIE ….    !!!  &lt;3  XX HAVE A NICE DAY!!:D﻿",t,CevxZvSJLk8,UC-8Q-hLdECwQmaWNwXitYDw,2013-09-05,Katy Perry - Roar (Official),15586013,760708,3673686440
49,Jack El Matador,2014-09-02,"should not have paused the music, this is a clip, not a movie.﻿",f,CevxZvSJLk8,UC-8Q-hLdECwQmaWNwXitYDw,2013-09-05,Katy Perry - Roar (Official),15586013,760708,3673686440
48,Justin Chery,2014-09-01,"And after the video ends, a 13 ft. boa constrictor squeezes her to death.﻿",f,CevxZvSJLk8,UC-8Q-hLdECwQmaWNwXitYDw,2013-09-05,Katy Perry - Roar (Official),15586013,760708,3673686440
47,Littleprincess,2014-08-31,Perfect! &lt;3﻿,f,CevxZvSJLk8,UC-8Q-hLdECwQmaWNwXitYDw,2013-09-05,Katy Perry - Roar (Official),15586013,760708,3673686440
46,Sam Klein,2014-08-31,"She named the tiger Kitty Purry  No, seriously, she did, check the video ﻿",f,CevxZvSJLk8,UC-8Q-hLdECwQmaWNwXitYDw,2013-09-05,Katy Perry - Roar (Official),15586013,760708,3673686440
45,ocean pacific,2014-08-30,The new Makeup Transformation with Integrated Look-A-Like Feature now  available in Ver 1.13! Do you know who you look like? Install or update  your version of Makeup Transformation  https://play.google.com/store/apps/details?id=com.yourelink.makeuptransformation  or visit Google Play.﻿,t,CevxZvSJLk8,UC-8Q-hLdECwQmaWNwXitYDw,2013-09-05,Katy Perry - Roar (Official),15586013,760708,3673686440
44,Rusty Cohle,2014-08-30,The TREU DETECTIVE alternate ending! __ http://www.funnyordie.com/videos/d15fb87973/true-defectives﻿,t,CevxZvSJLk8,UC-8Q-hLdECwQmaWNwXitYDw,2013-09-05,Katy Perry - Roar (Official),15586013,760708,3673686440
43,Frank co,2014-08-30,http://www.bubblews.com/news/6401116-vps-solutions﻿,t,CevxZvSJLk8,UC-8Q-hLdECwQmaWNwXitYDw,2013-09-05,Katy Perry - Roar (Official),15586013,760708,3673686440
42,Zain Hassan,2014-08-29,Thanks to this video we know that Nokia phones can survive a plane crash.﻿,f,CevxZvSJLk8,UC-8Q-hLdECwQmaWNwXitYDw,2013-09-05,Katy Perry - Roar (Official),15586013,760708,3673686440
41,Ach raf,2014-08-29,even without make up she is still  hot     http://uk.eonline.com/eol_images/Entire_Site/2012430/reg_1024.katy.mkup.mh.053012.jpg ﻿,t,CevxZvSJLk8,UC-8Q-hLdECwQmaWNwXitYDw,2013-09-05,Katy Perry - Roar (Official),15586013,760708,3673686440
40,Mai Nguyễn,2014-08-28,"help me click on the subscribe Mai Nguyen, thank you﻿",t,CevxZvSJLk8,UC-8Q-hLdECwQmaWNwXitYDw,2013-09-05,Katy Perry - Roar (Official),15586013,760708,3673686440
39,Angie Sivrikozi,2014-08-27,"Its a good song and i like her video clip, because its a bout a girl that  her airplane crashed on a land far far away... and she found the way to  survive! And i love the pet tiget too( Kitty Purpy) lol :D﻿",f,CevxZvSJLk8,UC-8Q-hLdECwQmaWNwXitYDw,2013-09-05,Katy Perry - Roar (Official),15586013,760708,3673686440
38,DicesMusic .,2014-08-27,ima rapper trying to get notice please check out my mixtape   datpiff.com/mixtapes-detail.php?id=633807﻿,t,CevxZvSJLk8,UC-8Q-hLdECwQmaWNwXitYDw,2013-09-05,Katy Perry - Roar (Official),15586013,760708,3673686440
37,Miguel Del Valle,2014-08-26,http://9gag.com/gag/aAVpwj9/ =)﻿,t,CevxZvSJLk8,UC-8Q-hLdECwQmaWNwXitYDw,2013-09-05,Katy Perry - Roar (Official),15586013,760708,3673686440
36,Paul Hannam,2014-08-25,In what South American jungle or any jungle for that matter do you find an  African elephant and a bengal tiger in the same place. Who made this video.﻿,f,CevxZvSJLk8,UC-8Q-hLdECwQmaWNwXitYDw,2013-09-05,Katy Perry - Roar (Official),15586013,760708,3673686440
35,Daniel Korp,2014-08-24,"katy perry does remind me of a tiger,like as if its her spirit animal :3 &lt;3﻿",f,CevxZvSJLk8,UC-8Q-hLdECwQmaWNwXitYDw,2013-09-05,Katy Perry - Roar (Official),15586013,760708,3673686440
34,MarianMusicChannel,2014-08-24,"Hello! I''m Marian, I''m a singer from Venezuela! I was part of a boy-girl band named cubik, and I''m now singing on my own  ''cause I wanted to play my own pop and pop-rock songs.  It would mean a lot if you could have a look at my channel to check my  music and watch my new video!! and if u like, subscribe to it! XOXO THANKS!!  PS: if you like a lot my channel, you can share it with your friends!!  Haha!! LOL MARIAN﻿",t,CevxZvSJLk8,UC-8Q-hLdECwQmaWNwXitYDw,2013-09-05,Katy Perry - Roar (Official),15586013,760708,3673686440
33,sleman zezo,2014-08-23,https://www.facebook.com/pages/%D8%AA%D8%AD%D9%85%D9%8A%D9%84-%D8%A7%D8%AC%D9%85%D9%84-%D8%A7%D9%84%D8%A7%D9%85%D9%88%D8%B3%D9%8A%D9%82%D9%89___-music/674732645945877 ﻿,t,CevxZvSJLk8,UC-8Q-hLdECwQmaWNwXitYDw,2013-09-05,Katy Perry - Roar (Official),15586013,760708,3673686440
32,zeynep saka,2014-08-23,I #votekatyperry for the 2014 MTV #VMA Best Lyric Video! See who's in the  lead and vote:  http://on.mtv.com/Ut15kX﻿,t,CevxZvSJLk8,UC-8Q-hLdECwQmaWNwXitYDw,2013-09-05,Katy Perry - Roar (Official),15586013,760708,3673686440
30,anne baba,2014-08-21,http://www.ebay.com/itm/131275322914?ssPageName=STRK:MESELX:IT&amp;_trksid=p3984.m1555.l2649 ﻿,t,CevxZvSJLk8,UC-8Q-hLdECwQmaWNwXitYDw,2013-09-05,Katy Perry - Roar (Official),15586013,760708,3673686440
29,phemion23,2014-08-21,http://www.mediafire.com/download/yvovhafsv5qzzqo/Video.rar    download and  make money today ﻿,t,CevxZvSJLk8,UC-8Q-hLdECwQmaWNwXitYDw,2013-09-05,Katy Perry - Roar (Official),15586013,760708,3673686440
28,Charles Baptist,2014-08-20,Help Please!!  http://www.gofundme.com/RJanimalcare﻿,t,CevxZvSJLk8,UC-8Q-hLdECwQmaWNwXitYDw,2013-09-05,Katy Perry - Roar (Official),15586013,760708,3673686440
27,Flynn Rider,2014-08-20,Watch Maroon 5's latest 2nd single from V (It Was Always You) www.youtube. com/watch?v=TQ046FuAu00﻿,t,CevxZvSJLk8,UC-8Q-hLdECwQmaWNwXitYDw,2013-09-05,Katy Perry - Roar (Official),15586013,760708,3673686440
26,Elle xox,2014-08-20,Hiya😊 I just started YouTube and it would mean a lot if some of you could  subscribe and watch my first video?xx﻿,t,CevxZvSJLk8,UC-8Q-hLdECwQmaWNwXitYDw,2013-09-05,Katy Perry - Roar (Official),15586013,760708,3673686440
